id	ngram	ngram_weight	pos	stall	gene	Note
YOR025W	ENSSEEDEEE	7	417	DE	HST3	Member of the Sir2 family of NAD(+)-dependent protein deacetylases; involved along with Hst4p in telomeric silencing, cell cycle progression, radiation resistance, genomic stability and short-chain fatty acid metabolism
YOR042W	AEDAKEEEEE	7	71	DE	CUE5	Protein containing a CUE domain that binds ubiquitin, which may facilitate intramolecular monoubiquitination; green fluorescent protein (GFP)-fusion protein localizes to the cytoplasm in a punctate pattern
YOR051C	ELDDDADLDD	7	42	DE	ETT1	Nuclear protein that inhibits replication of Brome mosaic virus in S. cerevisiae, which is a model system for studying replication of positive-strand RNA viruses in their natural hosts; deletion increases stop codon readthrough
YOR057W	LDIDEEADEE	7	325	DE	SGT1	Cochaperone protein; regulates activity of adenylyl cyclase Cyr1p; involved in kinetochore complex assembly; associates with the SCF (Skp1p/Cdc53p/F box protein) ubiquitin ligase complex; acts as a linker between Skp1p and HSP90 complexes
YOR065W	EEFEYDDEPD	7	129	DE	CYT1	Cytochrome c1, component of the mitochondrial respiratory chain; expression is regulated by the heme-activated, glucose-repressed Hap2p/3p/4p/5p CCAAT-binding complex
YOR078W	SSDEESDDDD	7	39	DE	BUD21	Component of small ribosomal subunit (SSU) processosome that contains U3 snoRNA; originally isolated as bud-site selection mutant that displays a random budding pattern
YOR087W	DDTEDDAGED	7	633	DE	YVC1	Vacuolar cation channel, mediates release of Ca(2+) from the vacuole in response to hyperosmotic shock
YOR098C	EENGDEGDDE	7	453	DE	NUP1	Nuclear pore complex (NPC) subunit, involved in protein import/export and in export of RNAs, possible karyopherin release factor that accelerates release of karyopherin-cargo complexes after transport across NPC; potential Cdc28p substrate
YOR144C	KEKCDDDDDD	7	81	DE	ELG1	Protein required for S phase progression and telomere homeostasis, forms an alternative replication factor C complex important for DNA replication and genome integrity; involved in homologous recombination-mediated DNA repair
YOR197W	TEDLDGDEED	7	223	DE	MCA1	Putative cysteine protease similar to mammalian caspases; involved in regulation of apoptosis upon hydrogen peroxide treatment; proposed to be involved in cell cycle progression
YOR206W	ESDDDNEDVE	7	696	DE	NOC2	Protein that forms a nucleolar complex with Mak21p that binds to 90S and 66S pre-ribosomes, as well as a nuclear complex with Noc3p that binds to 66S pre-ribosomes; both complexes mediate intranuclear transport of ribosomal precursors
YOR239W	PETNEEDEEE	7	81	DE	ABP140	Nonessential protein that binds actin filaments and localizes to actin patches and cables, has similarity to S-adenosylmethionine (AdoMet)-dependent methyltransferases
YOR243C	GIDDEDFDED	7	491	DE	PUS7	Pseudouridine synthase, catalyzes pseudouridylation at positions 35 and 56 in U2 snRNA, position 50 in 5S rRNA, position 13 in cytoplasmic tRNAs, and position 35 in pre-tRNA(Tyr); conserved in archaea, vertebrates, and some bacteria
YOR260W	DDDEDRNHDD	7	317	DE	GCD1	Gamma subunit of the translation initiation factor eIF2B, the guanine-nucleotide exchange factor for eIF2; activity subsequently regulated by phosphorylated eIF2; first identified as a negative regulator of GCN4 expression
YOR267C	EEETEENKED	7	510	DE	HRK1	Protein kinase implicated in activation of the plasma membrane H(+)-ATPase Pma1p in response to glucose metabolism; plays a role in ion homeostasis
YOR270C	MDADDAEEEE	7	688	DE	VPH1	Subunit a of vacuolar-ATPase V0 domain, one of two isoforms (Vph1p and Stv1p); Vph1p is located in V-ATPase complexes of the vacuole while Stv1p is located in V-ATPase complexes of the Golgi and endosomes
YOR272W	EDDDDEVNIE	7	186	DE	YTM1	Constituent of 66S pre-ribosomal particles, forms a complex with Nop7p and Erb1p that is required for maturation of the large ribosomal subunit; has seven C-terminal WD repeats
YOR276W	SGEDDEEETE	7	90	DE	CAF20	Phosphoprotein of the mRNA cap-binding complex involved in translational control, repressor of cap-dependent translation initiation, competes with eIF4G for binding to eIF4E
YOR279C	EEDEEGDGHD	7	215	DE	RFM1	DNA-binding protein required for vegetative repression of middle sporulation genes; specificity factor that directs the Hst1p histone deacetylase to some of the promoters regulated by Sum1p; involved in telomere maintenance
YOR287C	REESFDEDED	7	81	DE	RRP36	Component of 90S preribosomes; involved in early cleavages of the 35S pre-rRNA and in production of the 40S ribosomal subunit
YOR308C	LDIEEEEEGE	7	214	DE	SNU66	Component of the U4/U6.U5 snRNP complex involved in pre-mRNA splicing via spliceosome; also required for pre-5S rRNA processing and may act in concert with Rnh70p; has homology to human SART-1
YOR329C	EEVYEEVEDD	7	220	DE	SCD5	Protein required for normal actin organization and endocytosis; targeting subunit for protein phosphatase type 1; undergoes Crm1p-dependent nuclear-cytoplasmic shuttling; multicopy suppressor of clathrin deficiency
YOR341W	DDEAIEDNED	7	150	DE	RPA190	RNA polymerase I largest subunit A190
YOR370C	FDLDFEDEDE	7	557	DE	MRS6	Rab escort protein, forms a complex with the Ras-like small GTPase Ypt1p that is required for the prenylation of Ypt1p by protein geranylgeranyltransferase type II (Bet2p-Bet4p); sequence similarity to mammalian choroideraemia gene
YPL012W	DSDEFGDDDD	7	1184	DE	RRP12	Protein required for export of the ribosomal subunits; associates with the RNA components of the pre-ribosomes; contains HEAT-repeats
YPL023C	ESSEEEGEDE	7	309	DE	MET12	Protein with methylenetetrahydrofolate reductase (MTHFR) activity in vitro; null mutant has no phenotype and is prototrophic for methionine; MET13 encodes major isozyme of MTHFR
YPL026C	EEEDAEPESD	7	411	DE	SKS1	Putative serine/threonine protein kinase; involved in the adaptation to low concentrations of glucose independent of the SNF3 regulated pathway
YPL036W	DDSDSDEDID	7	61	DE	PMA2	Plasma membrane H+-ATPase, isoform of Pma1p, involved in pumping protons out of the cell; regulator of cytoplasmic pH and plasma membrane potential
YPL046C	EDDDEIPEFE	7	71	DE	ELC1	Elongin C, involved in transcription elongation as a heterodimer with Ela1p; required for ubiquitin-dependent degradation of Rpo21p; plays a role in global genomic nucleotide excision repair; expression highly upregulated during sporulation
YPL081W	ADEADEADEE	7	187	DE	RPS9A	Protein component of the small (40S) ribosomal subunit; nearly identical to Rps9Bp and has similarity to E. coli S4 and rat S9 ribosomal proteins
YPL085W	ENDDDLLDDD	7	511	DE	SEC16	COPII vesicle coat protein required for ER transport vesicle budding; Sec16p is bound to the periphery of ER membranes and may act to stabilize initial COPII complexes; interacts with Sec23p, Sec24p and Sec31p
YPL093W	EEEEEKLENE	7	456	DE	NOG1	Putative GTPase that associates with free 60S ribosomal subunits in the nucleolus and is required for 60S ribosomal subunit biogenesis; constituent of 66S pre-ribosomal particles; member of the ODN family of nucleolar G-proteins
YPL116W	EFSSEDEDEE	7	579	DE	HOS3	Trichostatin A-insensitive homodimeric histone deacetylase (HDAC) with specificity in vitro for histones H3, H4, H2A, and H2B; similar to Hda1p, Rpd3p, Hos1p, and Hos2p; deletion results in increased histone acetylation at rDNA repeats
YPL120W	DEEEQEATDE	7	134	DE	VPS30	Subunit of phosphatidylinositol (PtdIns) 3-kinase complexes I and II; Complex I is essential in autophagy and Complex II is required for vacuolar protein sorting; ortholog of the higher eukaryotic gene Beclin 1
YPL126W	TNDNDEDEED	7	842	DE	NAN1	U3 snoRNP protein, component of the small (ribosomal) subunit (SSU) processosome containing U3 snoRNA; required for the biogenesis of18S rRNA
YPL130W	EGGLEEEEEE	7	111	DE	SPO19	Meiosis-specific prospore protein; required to produce bending force necessary for proper assembly of the prospore membrane during sporulation; identified as a weak high-copy suppressor of the spo1-1 ts mutation
YPL131W	MEELADDDEE	7	207	DE	RPL5	Protein component of the large (60S) ribosomal subunit with similarity to E. coli L18 and rat L5 ribosomal proteins; binds 5S rRNA and is required for 60S subunit assembly
YPL150W	NERDEEGDDE	7	820	DE	NA	Putative protein kinase of unknown cellular role
YPL193W	EDDDRDEQLE	7	209	DE	RSA1	Protein involved in the assembly of 60S ribosomal subunits; functionally interacts with Dbp6p; functions in a late nucleoplasmic step of the assembly
YPL207W	DENADSEEDE	7	373	DE	TYW1	Protein required for the synthesis of wybutosine, a modified guanosine found at the 3'-position adjacent to the anticodon of phenylalanine tRNA which supports reading frame maintenance by stabilizing codon-anticodon interactions
YPL219W	EFYDDDDDND	7	21	DE	PCL8	Cyclin, interacts with Pho85p cyclin-dependent kinase (Cdk) to phosphorylate and regulate glycogen synthase, also activates Pho85p for Glc8p phosphorylation
YPL223C	DERYEDDNDD	7	17	DE	GRE1	Hydrophilin of unknown function; stress induced (osmotic, ionic, oxidative, heat shock and heavy metals); regulated by the HOG pathway
YPL240C	KDEEKKDEDD	7	229	DE	HSP82	Hsp90 chaperone required for pheromone signaling and negative regulation of Hsf1p; docks with Tom70p for mitochondrial preprotein delivery; promotes telomerase DNA binding and nucleotide addition; interacts with Cns1p, Cpr6p, Cpr7p, Sti1p
YPL256C	YQNEEEEEED	7	247	DE	CLN2	G1 cyclin involved in regulation of the cell cycle; activates Cdc28p kinase to promote the G1 to S phase transition; late G1 specific expression depends on transcription factor complexes, MBF (Swi6p-Mbp1p) and SBF (Swi6p-Swi4p)
YPR026W	EQEDDESLDD	7	1087	DE	ATH1	Acid trehalase required for utilization of extracellular trehalose
YPR049C	PNEDEEDENE	7	535	DE	ATG11	Adapter protein for pexophagy and the cytoplasm-to-vacuole targeting (Cvt) pathway; directs receptor-bound cargo to the phagophore assembly site (PAS) for packaging into vesicles; required for recruiting other proteins to the (PAS)
YPR067W	EFSDDLDDDD	7	113	DE	ISA2	Protein required for maturation of mitochondrial and cytosolic Fe/S proteins, localizes to the mitochondrial intermembrane space, overexpression of ISA2 suppresses grx5 mutations
YPR108W	LEEDDEGELE	7	119	DE	RPN7	Essential, non-ATPase regulatory subunit of the 26S proteasome, similar to another S. cerevisiae regulatory subunit, Rpn5p, as well as to mammalian proteasome subunits
YPR112C	DEDQEDAGEE	7	231	DE	MRD1	Essential conserved protein that is part of the 90S preribosome; required for production of 18S rRNA and small ribosomal subunit; contains five consensus RNA-binding domains
YPR137W	DEEDALESEE	7	42	DE	RRP9	Protein involved in pre-rRNA processing, associated with U3 snRNP; component of small ribosomal subunit (SSU) processosome; ortholog of the human U3-55k protein
YPR175W	DDDENNSDDE	7	115	DE	DPB2	Second largest subunit of DNA polymerase II (DNA polymerase epsilon), required for normal yeast chromosomal replication; expression peaks at the G1/S phase boundary; potential Cdc28p substrate
YAL005C	EAEKFKEEDE	6	517	DE	SSA1	ATPase involved in protein folding and nuclear localization signal (NLS)-directed nuclear transport; member of heat shock protein 70 (HSP70) family; forms a chaperone complex with Ydj1p; localized to the nucleus, cytoplasm, and cell wall
YAL012W	IEDTDDLLED	6	374	DE	CYS3	Cystathionine gamma-lyase, catalyzes one of the two reactions involved in the transsulfuration pathway that yields cysteine from homocysteine with the intermediary formation of cystathionine
YAL016W	TEVAQDDEDE	6	81	DE	TPD3	Regulatory subunit A of the heterotrimeric protein phosphatase 2A (PP2A), which also contains regulatory subunit Cdc55p and either catalytic subunit Pph21p or Pph22p; required for cell morphogenesis and transcription by RNA polymerase III
YAL017W	DTDELKEEID	6	415	DE	PSK1	One of two (see also PSK2) PAS domain containing S/T protein kinases; coordinately regulates protein synthesis and carbohydrate metabolism and storage in response to a unknown metabolite that reflects nutritional status
YAL021C	YSIDEDDDIE	6	310	DE	CCR4	Component of the CCR4-NOT transcriptional complex, which is involved in regulation of gene expression; component of the major cytoplasmic deadenylase, which is involved in mRNA poly(A) tail shortening
YAL022C	TRDDNDEGEE	6	317	DE	FUN26	Nucleoside transporter with broad nucleoside selectivity; localized to intracellular membranes
YAL024C	EEEEEFLNSD	6	427	DE	LTE1	Protein similar to GDP/GTP exchange factors but without detectable GEF activity; required for asymmetric localization of Bfa1p at daughter-directed spindle pole bodies and for mitotic exit at low temperatures
YAL026C	EETIDLDADD	6	55	DE	DRS2	Aminophospholipid translocase (flippase) that maintains membrane lipid asymmetry in post-Golgi secretory vesicles; contributes to clathrin-coated vesicle formation and endocytosis; mutations in human homolog ATP8B1 result in liver disease
YAL033W	RENENENEDD	6	163	DE	POP5	Subunit of both RNase MRP, which cleaves pre-rRNA, and nuclear RNase P, which cleaves tRNA precursors to generate mature 5' ends
YAL047C	DNTGDDDDSE	6	15	DE	SPC72	Component of the cytoplasmic Tub4p (gamma-tubulin) complex, binds spindle pole bodies and links them to microtubules; has roles in astral microtubule formation and stabilization
YAL048C	DDDIDTKVED	6	135	DE	GEM1	Evolutionarily-conserved tail-anchored outer mitochondrial membrane GTPase which regulates mitochondrial morphology; cells lacking Gem1p contain collapsed, globular, or grape-like mitochondria; not required for pheromone-induced cell death
YAL059W	EGNAEKEDEE	6	171	DE	ECM1	Pre-ribosomal factor involved in 60S ribosomal protein subunit export; associates with the pre-60S particle; shuttles between the nucleus and cytoplasm
YAR002W	DIENKEEEYD	6	100	DE	NUP60	Subunit of the nuclear pore complex (NPC), functions to anchor Nup2p to the NPC in a process controlled by the nucleoplasmic concentration of Gsp1p-GTP; involved in nuclear export and cytoplasmic localization of specific mRNAs such as ASH1
YBL004W	YKDEEDMENE	6	806	DE	UTP20	Component of the small-subunit (SSU) processome, which is involved in the biogenesis of the 18S rRNA
YBL017C	DNEENSGDEE	6	153	DE	PEP1	Type I transmembrane sorting receptor for multiple vacuolar hydrolases; cycles between the late-Golgi and prevacuolar endosome-like compartments
YBL025W	EEIDADVEKD	6	42	DE	RRN10	Protein involved in promoting high level transcription of rDNA, subunit of UAF (upstream activation factor) for RNA polymerase I
YBL058W	RGQADDDDED	6	133	DE	SHP1	UBX (ubiquitin regulatory X) domain-containing protein that regulates Glc7p phosphatase activity and interacts with Cdc48p; interacts with ubiquitylated proteins in vivo and is required for degradation of a ubiquitylated model substrate
YBL063W	DLLSDSEDDD	6	209	DE	KIP1	Kinesin-related motor protein required for mitotic spindle assembly, chromosome segregation, and 2 micron plasmid partitioning; functionally redundant with Cin8p for chromosomal but not plasmid functions
YBL085W	RDAEEEEGRD	6	930	DE	BOI1	Protein implicated in polar growth, functionally redundant with Boi2p; interacts with bud-emergence protein Bem1p; contains an SH3 (src homology 3) domain and a PH (pleckstrin homology) domain
YBL097W	ENNDDDERVE	6	7	DE	BRN1	Subunit of the condensin complex; required for chromosome condensation and for clustering of tRNA genes at the nucleolus; may influence multiple aspects of chromosome transmission
YBL113C	DEEYKEYLED	6	519	DE	NA	Helicase-like protein encoded within the telomeric Y' element
YBR002C	RLEEGDYDEE	6	262	DE	RER2	Cis-prenyltransferase involved in dolichol synthesis; participates in endoplasmic reticulum (ER) protein sorting
YBR021W	VDDFEEEWKD	6	599	DE	FUR4	Uracil permease, localized to the plasma membrane; expression is tightly regulated by uracil levels and environmental cues
YBR023C	DEGVAEDEFD	6	125	DE	CHS3	Chitin synthase III, catalyzes the transfer of N-acetylglucosamine (GlcNAc) to chitin; required for synthesis of the majority of cell wall chitin, the chitin ring during bud emergence, and spore wall chitosan
YBR028C	DSAVDEEDPE	6	304	DE	NA	Putative protein kinase, possible substrate of cAMP-dependent protein kinase (PKA)
YBR045C	DDTLDKDIDD	6	355	DE	GIP1	Meiosis-specific regulatory subunit of the Glc7p protein phosphatase, regulates spore wall formation and septin organization, required for expression of some late meiotic genes and for normal localization of Glc7p
YBR049C	HNQQDDEDDE	6	112	DE	REB1	RNA polymerase I enhancer binding protein; DNA binding protein which binds to genes transcribed by both RNA polymerase I and RNA polymerase II; required for termination of RNA polymerase I transcription
YBR054W	QEEEEDVATD	6	332	DE	YRO2	Putative protein of unknown function; the authentic, non-tagged protein is detected in a phosphorylated state in highly purified mitochondria in high-throughput studies; transcriptionally regulated by Haa1p
YBR055C	SQPKDDEDDE	6	56	DE	PRP6	Splicing factor, component of the U4/U6-U5 snRNP complex
YBR069C	EIDKVDDNDD	6	579	DE	TAT1	Amino acid transport protein for valine, leucine, isoleucine, and tyrosine, low-affinity tryptophan and histidine transporter; overexpression confers FK506 and FTY720 resistance
YBR071W	EDIEEMDKTD	6	146	DE	NA	Putative protein of unknown function; (GFP)-fusion and epitope-tagged proteins localize to the cytoplasm; mRNA expression may be regulated by the cell cycle and/or cell wall stress
YBR077C	WSEDENDTEE	6	79	DE	SLM4	Component of the EGO complex, which is involved in the regulation of microautophagy, and of the GSE complex, which is required for proper sorting of amino acid permease Gap1p; gene exhibits synthetic genetic interaction with MSS4
YBR084W	VEVDDDGEIE	6	962	DE	MIS1	Mitochondrial C1-tetrahydrofolate synthase, involved in interconversion between different oxidation states of tetrahydrofolate (THF); provides activities of formyl-THF synthetase, methenyl-THF cyclohydrolase, and methylene-THF dehydrogenase
YBR092C	IRDDDDLEME	6	116	DE	PHO3	Constitutively expressed acid phosphatase similar to Pho5p; brought to the cell surface by transport vesicles; hydrolyzes thiamin phosphates in the periplasmic space, increasing cellular thiamin uptake; expression is repressed by thiamin
YBR093C	IRDDDDLEME	6	116	DE	PHO5	Repressible acid phosphatase (1 of 3) that also mediates extracellular nucleotide-derived phosphate hydrolysis; secretory pathway derived cell surface glycoprotein; induced by phosphate starvation and coordinately regulated by PHO4 and PHO2
YBR102C	DEGVEEIDIE	6	536	DE	EXO84	Essential protein with dual roles in spliceosome assembly and exocytosis; the exocyst complex (Sec3p, Sec5p, Sec6p, Sec8p, Sec10p, Sec15p, Exo70p, and Exo84p) mediates polarized targeting of secretory vesicles to active sites of exocytosis
YBR112C	QVEEDENYDD	6	956	DE	CYC8	General transcriptional co-repressor, acts together with Tup1p; also acts as part of a transcriptional co-activator complex that recruits the SWI/SNF and SAGA complexes to promoters; can form the prion [OCT+]
YBR117C	EVDKGDDDME	6	215	DE	TKL2	Transketolase, similar to Tkl1p; catalyzes conversion of xylulose-5-phosphate and ribose-5-phosphate to sedoheptulose-7-phosphate and glyceraldehyde-3-phosphate in the pentose phosphate pathway; needed for synthesis of aromatic amino acids
YBR121C	DDDVVKEYEE	6	160	DE	GRS1	Cytoplasmic and mitochondrial glycyl-tRNA synthase that ligates glycine to the cognate anticodon bearing tRNA; transcription termination factor that may interact with the 3'-end of pre-mRNA to promote 3'-end formation
YBR131W	EELQVEEEQE	6	278	DE	CCZ1	Protein involved in vacuolar assembly, essential for autophagy and the cytoplasm-to-vacuole pathway
YBR133C	DLDQDIENEE	6	729	DE	HSL7	Protein arginine N-methyltransferase that exhibits septin and Hsl1p-dependent bud neck localization and periodic Hsl1p-dependent phosphorylation; required along with Hsl1p for bud neck recruitment, phosphorylation, and degradation of Swe1p
YBR140C	KVDMKEEEED	6	2033	DE	IRA1	GTPase-activating protein that negatively regulates RAS by converting it from the GTP- to the GDP-bound inactive form, required for reducing cAMP levels under nutrient limiting conditions, mediates membrane association of adenylate cyclase
YBR152W	ESDESPESEE	6	71	DE	SPP381	mRNA splicing factor, component of U4/U6.U5 tri-snRNP; interacts genetically and physically with Prp38p
YBR169C	SDDSDDNNDE	6	678	DE	SSE2	Member of the heat shock protein 70 (HSP70) family; may be involved in protein folding; localized to the cytoplasm; highly homologous to the heat shock protein Sse1p
YBR170C	AVDEELEKED	6	116	DE	NPL4	Endoplasmic reticulum and nuclear membrane protein, forms a complex with Cdc48p and Ufd1p that recognizes ubiquitinated proteins in the endoplasmic reticulum and delivers them to the proteasome for degradation
YBR179C	DGEEGRREDD	6	58	DE	FZO1	Mitofusin, mitochondrial integral membrane protein involved in mitochondrial fusion and mitochondrial genome maintenance; contains N-terminal GTPase domain; targeted for destruction by cytosolic components of the ubiquitin-proteasome system
YBR184W	EEKEDLDIMD	6	53	DE	NA	Putative protein of unknown function; YBR184W is not an essential gene
YBR186W	DKIDLELDED	6	209	DE	PCH2	Nucleolar component of the pachytene checkpoint, which prevents chromosome segregation when recombination and chromosome synapsis are defective; also represses meiotic interhomolog recombination in the rDNA
YBR192W	IEEWEEDAIE	6	5	DE	RIM2	Mitochondrial pyrimidine nucleotide transporter; imports pyrimidine nucleoside triphosphates and exports pyrimidine nucleoside monophosphates; member of the mitochondrial carrier family
YBR199W	DEEFTDEFKD	6	172	DE	KTR4	Putative mannosyltransferase involved in protein glycosylation; member of the KRE2/MNT1 mannosyltransferase family
YBR202W	ENEDENLDAE	6	40	DE	MCM7	Component of the hexameric MCM complex, which is important for priming origins of DNA replication in G1 and becomes an active ATP-dependent helicase that promotes DNA melting and elongation when activated by Cdc7p-Dbf4p in S-phase
YBR207W	NVEEEEEIYE	6	94	DE	FTH1	Putative high affinity iron transporter involved in transport of intravacuolar stores of iron; forms complex with Fet5p; expression is regulated by iron; proposed to play indirect role in endocytosis
YBR208C	EEDLDKMTED	6	1678	DE	DUR1,2	Urea amidolyase, contains both urea carboxylase and allophanate hydrolase activities, degrades urea to CO2 and NH3; expression sensitive to nitrogen catabolite repression and induced by allophanate, an intermediate in allantoin degradation
YBR211C	DSEDDSIRDD	6	276	DE	AME1	Essential kinetochore protein associated with microtubules and spindle pole bodies; component of the kinetochore sub-complex COMA (Ctf19p, Okp1p, Mcm21p, Ame1p); involved in spindle checkpoint maintenance
YBR213W	KDEYLDLEDE	6	93	DE	MET8	Bifunctional dehydrogenase and ferrochelatase, involved in the biosynthesis of siroheme, a prosthetic group used by sulfite reductase; required for sulfate assimilation and methionine biosynthesis
YBR214W	DTDDKEQPEE	6	43	DE	SDS24	One of two S. cerevisiae homologs (Sds23p and Sds24p) of the S. pombe Sds23 protein, which is implicated in APC/cyclosome regulation; involved in cell separation during budding; may play an indirect role in fluid-phase endocytosis
YBR217W	ESENETESDE	6	5	DE	ATG12	Conserved ubiquitin-like modifier involved in autophagy and the Cvt pathway; conjugated to Atg5p to form a complex involved in Atg8p lipidation; Atg12p-Atg5p also forms a complex with Atg16p that is required for autophagosome formation
YBR221C	MAEELDRDDD	6	48	DE	PDB1	E1 beta subunit of the pyruvate dehydrogenase (PDH) complex, which is an evolutionarily-conserved multi-protein complex found in mitochondria
YBR235W	ESEDSDLDTD	6	913	DE	NA	Putative ion transporter, similar to mammalian electroneutral Na(+)-(K+)-C1- cotransporter family; YBR235W is not an essential gene
YBR261C	TDTDDFDETD	6	175	DE	TAE1	AdoMet-dependent proline methyltransferase; catalyzes the dimethylation of ribosomal proteins Rpl12 and Rps25 at N-terminal proline residues; has a role in protein synthesis; fusion protein localizes to the cytoplasm
YBR267W	ENEENKEKEE	6	120	DE	REI1	Cytoplasmic pre-60S factor; required for the correct recycling of shuttling factors Alb1, Arx1 and Tif6 at the end of the ribosomal large subunit biogenesis; involved in bud growth in the mitotic signaling network
YBR275C	IDDETLEEVD	6	1362	DE	RIF1	Protein that binds to the Rap1p C-terminus and acts synergistically with Rif2p to help control telomere length and establish telomeric silencing; deletion results in telomere elongation
YBR287W	EELVNEEQEE	6	204	DE	NA	Protein of unknown function; green fluorescent protein (GFP)-fusion protein localizes to the ER; YBR287W is not an essential gene
YBR294W	KDDVDYTDED	6	813	DE	SUL1	High affinity sulfate permease; sulfate uptake is mediated by specific sulfate transporters Sul1p and Sul2p, which control the concentration of endogenous activated sulfate intermediates
YBR297W	LNDDSKDEDD	6	455	DE	MAL33	MAL-activator protein, part of complex locus MAL3; nonfunctional in genomic reference strain S288C
YCL009C	STEEAADEDE	6	285	DE	ILV6	Regulatory subunit of acetolactate synthase, which catalyzes the first step of branched-chain amino acid biosynthesis; enhances activity of the Ilv2p catalytic subunit, localizes to mitochondria
YCL010C	EEKSEENTED	6	79	DE	SGF29	Probable subunit of SAGA histone acetyltransferase complex
YCL014W	EDELPTESDD	6	249	DE	BUD3	Protein involved in bud-site selection and required for axial budding pattern; localizes with septins to bud neck in mitosis and may constitute an axial landmark for next round of budding
YCL024W	IDDDDWEYIE	6	504	DE	KCC4	Protein kinase of the bud neck involved in the septin checkpoint, associates with septin proteins, negatively regulates Swe1p by phosphorylation, shows structural homology to bud neck kinases Gin4p and Hsl1p
