id	ngram	ngram_weight	pos	stall	gene	Note
YOR315W	EDEDNEEDNE	8	291	DE	SFG1	Nuclear protein, putative transcription factor required for growth of superficial pseudohyphae (which do not invade the agar substrate) but not for invasive pseudohyphal growth; may act together with Phd1p; potential Cdc28p substrate
YOR358W	DGEMDEDDEE	8	101	DE	HAP5	Subunit of the heme-activated, glucose-repressed Hap2/3/4/5 CCAAT-binding complex, a transcriptional activator and global regulator of respiratory gene expression; required for assembly and DNA binding activity of the complex
YPL064C	EDEQEDDDGD	8	198	DE	CWC27	Component of a complex containing Cef1p, putatively involved in pre-mRNA splicing; has similarity to S. pombe Cwf27p
YPL089C	DDDENNDEDD	8	122	DE	RLM1	MADS-box transcription factor, component of the protein kinase C-mediated MAP kinase pathway involved in the maintenance of cell integrity; phosphorylated and activated by the MAP-kinase Slt2p
YPL100W	DAEEEEDNED	8	74	DE	ATG21	Phosphoinositide binding protein required for vesicle formation in the cytoplasm-to-vacuole targeting (Cvt) pathway; binds both phosphatidylinositol (3,5)-bisphosphate and phosphatidylinositol 3-phosphate; WD-40 repeat protein
YPL181W	GDEEDEVEDE	8	184	DE	CTI6	Protein that relieves transcriptional repression by binding to the Cyc8p-Tup1p corepressor and recruiting the SAGA complex to the repressed promoter; contains a PHD finger domain
YPL201C	SEEDDDGDEE	8	70	DE	YIG1	Protein that interacts with glycerol 3-phosphatase and plays a role in anaerobic glycerol production; localizes to the nucleus and cytosol
YPL217C	ESEDEDENED	8	680	DE	BMS1	GTPase required for synthesis of 40S ribosomal subunits and for processing the 35S pre-rRNA at sites A0, A1, and A2; interacts with Rcl1p, which stimulates its GTPase and U3 snoRNA binding activities; has similarity to Tsr1p
YPL228W	DDEETDTDDE	8	85	DE	CET1	Beta (RNA 5'-triphosphatase) subunit of the mRNA capping enzyme, a heterodimer (the other subunit is CEG1, a guanylyltransferase) involved in adding the 5' cap to mRNA; the mammalian enzyme is a single bifunctional polypeptide
YPL239W	DVEPEDDEED	8	150	DE	YAR1	Cytoplasmic ankyrin-repeat containing protein of unknown function, proposed to link the processes of 40S ribosomal subunit biogenesis and adaptation to osmotic and oxidative stress; expression repressed by heat shock
YPR029C	DEDEDEDGID	8	215	DE	APL4	Gamma-adaptin, large subunit of the clathrin-associated protein (AP-1) complex; binds clathrin; involved in vesicle mediated transport
YPR097W	DEDEYEEEGE	8	437	DE	NA	Protein that contains a Phox homology (PX) domain and binds phosphoinositides; the authentic, non-tagged protein is detected in highly purified mitochondria in high-throughput studies
YPR135W	EDEEDFIDDD	8	428	DE	CTF4	Chromatin-associated protein, required for sister chromatid cohesion; interacts with DNA polymerase alpha (Pol1p) and may link DNA synthesis to sister chromatid cohesion
YPR185W	VEEDDDDEND	8	618	DE	ATG13	Regulatory subunit of the Atg1p signaling complex; stimulates Atg1p kinase activity; required for vesicle formation during autophagy and the cytoplasm-to-vacuole targeting (Cvt) pathway; involved in Atg9p, Atg23p, and Atg27p cycling
YPR189W	DEEAKEDEEE	8	386	DE	SKI3	Ski complex component and TPR protein, mediates 3'-5' RNA degradation by the cytoplasmic exosome; null mutants have superkiller phenotype of increased viral dsRNAs and are synthetic lethal with mutations in 5'-3' mRNA decay
YAL013W	ENEDESKEEE	7	108	DE	DEP1	Transcriptional modulator involved in regulation of structural phospholipid biosynthesis genes and metabolically unrelated genes, as well as maintenance of telomeres, mating efficiency, and sporulation
YAL014C	YKDDDEQDEE	7	112	DE	SYN8	Endosomal SNARE related to mammalian syntaxin 8
YAL056W	EDDEDRQDSE	7	813	DE	GPB2	Multistep regulator of cAMP-PKA signaling; inhibits PKA downstream of Gpa2p and Cyr1p, thereby increasing cAMP dependency; inhibits Ras activity through direct interactions with Ira1p/2p; regulated by G-alpha protein Gpa2p; homolog of Gpb1p
YAR003W	EKEDEFDEVD	7	365	DE	SWD1	Subunit of the COMPASS (Set1C) complex, which methylates histone H3 on lysine 4 and is required in transcriptional silencing near telomeres; WD40 beta propeller superfamily member with similarity to mammalian Rbbp7
YAR014C	RDDDKELEEE	7	119	DE	BUD14	Protein involved in bud-site selection, Bud14p-Glc7p complex is a cortical regulator of dynein; inhibitor of the actin assembly factor Bnr1p (formin); diploid mutants display a random budding pattern instead of the wild-type bipolar pattern
YBL014C	DMDDINEEDE	7	775	DE	RRN6	Component of the core factor (CF) rDNA transcription factor complex; CF is required for transcription of 35S rRNA genes by RNA polymerase I and is composed of Rrn6p, Rrn7p, and Rrn11p
YBL022C	TEEESEELDD	7	347	DE	PIM1	ATP-dependent Lon protease, involved in degradation of misfolded proteins in mitochondria; required for biogenesis and maintenance of mitochondria
YBL023C	EEDDSDSENE	7	9	DE	MCM2	Protein involved in DNA replication; component of the Mcm2-7 hexameric complex that binds chromatin as a part of the pre-replicative complex
YBL032W	ERKDDDDKDE	7	294	DE	HEK2	RNA binding protein involved in the asymmetric localization of ASH1 mRNA; represses translation of ASH1 mRNA, an effect reversed by Yck1p-dependent phosphoryation; regulates telomere position effect and length; similarity to hnRNP-K
YBL034C	DEESDDAVDE	7	1014	DE	STU1	Component of the mitotic spindle that binds to interpolar microtubules via its association with beta-tubulin (Tub2p); required for interpolar microtubules to provide an outward force on the spindle poles
YBL047C	DDDEFEDTRE	7	1132	DE	EDE1	Key endocytic protein involved in a network of interactions with other endocytic proteins, binds membranes in a ubiquitin-dependent manner, may also bind ubiquitinated membrane-associated proteins
YBL056W	DDNDDNDGEE	7	441	DE	PTC3	Type 2C protein phosphatase (PP2C); dephosphorylates Hog1p (see also Ptc2p) to limit maximal kinase activity induced by osmotic stress; dephosphorylates T169 phosphorylated Cdc28p (see also Ptc2p); role in DNA checkpoint inactivation
YBL066C	DEESEEDNND	7	522	DE	SEF1	Putative transcription factor, has homolog in Kluyveromyces lactis
YBR079C	ETEDGEEKEE	7	531	DE	RPG1	eIF3a subunit of the core complex of translation initiation factor 3 (eIF3), essential for translation; part of a Prt1p-Rpg1p-Nip1p subcomplex that stimulates binding of mRNA and tRNA(i)Met to ribosomes; involved in translation reinitiation
YBR094W	FDDEDSEAEE	7	504	DE	PBY1	Putative tubulin tyrosine ligase associated with P-bodies
YBR095C	DEYYGEEDDD	7	144	DE	RXT2	Subunit of the histone deacetylase Rpd3L complex; possibly involved in cell fusion and invasive growth
YBR108W	SDEEYDSEDE	7	57	DE	AIM3	Protein interacting with Rvs167p; null mutant is viable and displays elevated frequency of mitochondrial genome loss
YBR114W	EERDVSDDDE	7	103	DE	RAD16	Protein that recognizes and binds damaged DNA in an ATP-dependent manner (with Rad7p) during nucleotide excision repair; subunit of Nucleotide Excision Repair Factor 4 (NEF4) and the Elongin-Cullin-Socs (ECS) ligase complex
YBR123C	DDDVDDVDAD	7	594	DE	TFC1	One of six subunits of the RNA polymerase III transcription initiation factor complex (TFIIIC); part of the TauA globular domain of TFIIIC that binds DNA at the BoxA promoter sites of tRNA and similar genes; human homolog is TFIIIC-63
YBR143C	DESEDEYYDE	7	418	DE	SUP45	Polypeptide release factor (eRF1) in translation termination; mutant form acts as a recessive omnipotent suppressor; methylated by Mtq2p-Trm112p in ternary complex eRF1-eRF3-GTP; mutation of methylation site confers resistance to zymocin
YBR148W	DESVLEDEDD	7	93	DE	YSW1	Protein required for normal prospore membrane formation; interacts with Gip1p, which is the meiosis-specific regulatory subunit of the Glc7p protein phosphatase; expressed specifically in spores and localizes to the prospore membrane
YBR167C	DMESDVEDDD	7	111	DE	POP7	Subunit of both RNase MRP, which cleaves pre-rRNA, and nuclear RNase P, which cleaves tRNA precursors to generate mature 5' ends
YBR187W	EEEMAEVEEE	7	133	DE	GDT1	Putative protein of unknown function; expression is reduced in a gcr1 null mutant; GFP-fusion protein localizes to the vacuole; expression pattern and physical interactions suggest a possible role in ribosome biogenesis
YBR189W	EAAEEAEDEE	7	185	DE	RPS9B	Protein component of the small (40S) ribosomal subunit; nearly identical to Rps9Ap and has similarity to E. coli S4 and rat S9 ribosomal proteins
YBR231C	PNEKEDEDED	7	9	DE	SWC5	Protein of unknown function, component of the SWR1 complex, which exchanges histone variant H2AZ (Htz1p) for chromatin-bound histone H2A
YBR237W	DDEDVEDNTD	7	175	DE	PRP5	RNA helicase in the DEAD-box family, necessary for prespliceosome formation, bridges U1 and U2 snRNPs and enables stable U2 snRNP association with intron RNA
YBR245C	LKEEDSDDDE	7	169	DE	ISW1	Member of the imitation-switch (ISWI) class of ATP-dependent chromatin remodeling complexes; ATPase that forms a complex with Ioc2p and Ioc4p to regulate transcription elongation, and a complex with Ioc3p to repress transcription initiation
YBR290W	SDEEDSIEDE	7	46	DE	BSD2	Heavy metal ion homeostasis protein, facilitates trafficking of Smf1p and Smf2p metal transporters to the vacuole where they are degraded, controls metal ion transport, prevents metal hyperaccumulation, functions in copper detoxification
YCL049C	LTFEEEEEEE	7	282	DE	NA	Protein of unknown function; localizes to membrane fraction; YCL049C is not an essential gene
YCL061C	ESDSEKEDDE	7	577	DE	MRC1	S-phase checkpoint protein required for DNA replication; interacts with and stabilizes Pol2p at stalled replication forks during stress, where it forms a pausing complex with Tof1p and is phosphorylated by Mec1p; protects uncapped telomeres
YCL063W	FDEMDDEDFD	7	225	DE	VAC17	Phosphoprotein involved in vacuole inheritance; degraded in late M phase of the cell cycle; acts as a vacuole-specific receptor for myosin Myo2p
YCR014C	LLIEEEEEEE	7	468	DE	POL4	DNA polymerase IV, undergoes pair-wise interactions with Dnl4p-Lif1p and Rad27p to mediate repair of DNA double-strand breaks by non-homologous end joining (NHEJ); homologous to mammalian DNA polymerase beta
YCR026C	EEVEIEDDFD	7	609	DE	NPP1	Nucleotide pyrophosphatase/phosphodiesterase family member; mediates extracellular nucleotide phosphate hydrolysis along with Npp2p and Pho5p; activity and expression enhanced during conditions of phosphate starvation
YCR028C	DMPGEDDDDD	7	472	DE	FEN2	Plasma membrane H+-pantothenate symporter; confers sensitivity to the antifungal agent fenpropimorph
YCR035C	EEEEVDIDMD	7	314	DE	RRP43	Exosome non-catalytic core component; involved in 3'-5' RNA processing and degradation in both the nucleus and the cytoplasm; has similarity to E. coli RNase PH and to human hRrp43p (OIP2, EXOSC8)
YCR065W	DDLPDEEERE	7	231	DE	HCM1	Forkhead transcription factor that drives S-phase specific expression of genes involved in chromosome segregation, spindle dynamics, and budding; suppressor of calmodulin mutants with specific SPB assembly defects; telomere maintenance role
YCR073C	RYEEDDGDDE	7	96	DE	SSK22	MAP kinase kinase kinase of the HOG1 mitogen-activated signaling pathway; functionally redundant with, and homologous to, Ssk2p; interacts with and is activated by Ssk1p; phosphorylates Pbs2p
YCR081W	GEEEDADQEE	7	1333	DE	SRB8	Subunit of the RNA polymerase II mediator complex; associates with core polymerase subunits to form the RNA polymerase II holoenzyme; essential for transcriptional regulation; involved in glucose repression
YDL002C	DADDDKEENE	7	164	DE	NHP10	Protein related to mammalian high mobility group proteins; preferentially binds DNA ends, protecting them from exonucleatic cleavage; likely component of the chromatin-remodeling complex INO80 complex; proposed to be involved in DNA repair
YDL013W	DENDEDWTDD	7	221	DE	SLX5	Subunit of the Slx5-Slx8 SUMO-targeted ubiquitin ligase (STUbL) complex, stimulated by SUMO-modified substrates; contains a RING domain and two SIMs (SUMO-interacting motifs); forms SUMO-dependent nuclear foci, including DNA repair centers
YDL019C	DEANSDDEEE	7	556	DE	OSH2	Member of an oxysterol-binding protein family with seven members in S. cerevisiae; family members have overlapping, redundant functions in sterol metabolism and collectively perform a function essential for viability
YDL025C	FTEEPEDEDD	7	522	DE	RTK1	Putative protein kinase, potentially phosphorylated by Cdc28p; interacts with ribosome biogenesis factors, Cka2, Gus1 and Arc1
YDL060W	DEEYDIEDNE	7	445	DE	TSR1	Protein required for processing of 20S pre-rRNA in the cytoplasm, associates with pre-40S ribosomal particles
YDL065C	DDLDDLLDED	7	9	DE	PEX19	Chaperone and import receptor for newly-synthesized class I peroxisomal membrane proteins (PMPs), binds PMPs in the cytoplasm and delivers them to the peroxisome for subsequent insertion into the peroxisomal membrane
YDL070W	SSDDEYDDED	7	448	DE	BDF2	Protein involved in transcription initiation at TATA-containing promoters; associates with the basal transcription factor TFIID; contains two bromodomains; corresponds to the C-terminal region of mammalian TAF1; redundant with Bdf1p
YDL073W	ENEDNDEDSE	7	687	DE	NA	Putative protein of unknown function; YDL073W is not an essential gene
YDL077C	DDGSEDDDQE	7	382	DE	VAM6	Vacuolar protein that plays a critical role in the tethering steps of vacuolar membrane fusion by facilitating guanine nucleotide exchange on small guanosine triphosphatase Ypt7p
YDL081C	EAEAEKEEEE	7	81	DE	RPP1A	Ribosomal stalk protein P1 alpha, involved in the interaction between translational elongation factors and the ribosome; accumulation of P1 in the cytoplasm is regulated by phosphorylation and interaction with the P2 stalk component
YDL099W	DVDEESEEKE	7	81	DE	BUG1	Cis-golgi localized protein involved in ER to Golgi transport; forms a complex with the mammalian GRASP65 homolog, Grh1p; mutants are compromised for the fusion of ER-derived vesicles with Golgi membranes
YDL121C	EDELDERREE	7	120	DE	NA	Putative protein of unknown function; green fluorescent protein (GFP)-fusion protein localizes to the endoplasmic reticulum; YDL121C is not an essential protein
YDL122W	EQEFEDSEEE	7	548	DE	UBP1	Ubiquitin-specific protease that removes ubiquitin from ubiquitinated proteins; cleaves at the C terminus of ubiquitin fusions irrespective of their size; capable of cleaving polyubiquitin chains
YDL126C	DLDEDEIDAE	7	440	DE	CDC48	ATPase in ER, nuclear membrane and cytosol with homology to mammalian p97; in a complex with Npl4p and Ufd1p participates in retrotranslocation of ubiquitinated proteins from the ER into the cytosol for degradation by the proteasome
YDL130W	EEEKEEEAAE	7	84	DE	RPP1B	Ribosomal protein P1 beta, component of the ribosomal stalk, which is involved in interaction of translational elongation factors with ribosome; accumulation is regulated by phosphorylation and interaction with the P2 stalk component
YDL139C	DEEDGDKNDE	7	165	DE	SCM3	Nonhistone component of centromeric chromatin that binds stoichiometrically to CenH3-H4 histones, required for kinetochore assembly; required for G2/M progression and localization of Cse4p; may protect Cse4p from ubiquitylation
YDL148C	NLEDDEDDGD	7	149	DE	NOP14	Nucleolar protein, forms a complex with Noc4p that mediates maturation and nuclear export of 40S ribosomal subunits; also present in the small subunit processome complex, which is required for processing of pre-18S rRNA
YDL150W	ENEAEDDDNE	7	138	DE	RPC53	RNA polymerase III subunit C53
YDL169C	ERDESDEDND	7	103	DE	UGX2	Protein of unknown function, transcript accumulates in response to any combination of stress conditions
YDL190C	DEEEDLEYGD	7	870	DE	UFD2	Ubiquitin chain assembly factor (E4) that cooperates with a ubiquitin-activating enzyme (E1), a ubiquitin-conjugating enzyme (E2), and a ubiquitin protein ligase (E3) to conjugate ubiquitin to substrates; also functions as an E3
YDL225W	EVDPEDDDLE	7	248	DE	SHS1	One of five related septins (Cdc3p, Cdc10p, Cdc11p, Cdc12p, Shs1p) that form a cortical filamentous collar at the mother-bud neck which is necessary for normal morphogenesis and cytokinesis
YDL234C	LQFDDEDEEE	7	433	DE	GYP7	GTPase-activating protein for yeast Rab family members including: Ypt7p (most effective), Ypt1p, Ypt31p, and Ypt32p (in vitro); involved in vesicle mediated protein trafficking
YDR022C	DDKSNDEEEE	7	131	DE	CIS1	Autophagy-specific protein required for autophagosome formation; may form a complex with Atg17p and Atg29p that localizes other proteins to the pre-autophagosomal structure; high-copy suppressor of CIK1 deletion
YDR072C	SEEDSEDEGD	7	338	DE	IPT1	Inositolphosphotransferase, involved in synthesis of mannose-(inositol-P)2-ceramide (M(IP)2C), the most abundant sphingolipid;, can mutate to resistance to the antifungals syringomycin E and DmAMP1 and to K. lactis zymocin
YDR097C	DKNDGDEDDD	7	175	DE	MSH6	Protein required for mismatch repair in mitosis and meiosis, forms a complex with Msh2p to repair both single-base & insertion-deletion mispairs; potentially phosphorylated by Cdc28p
YDR113C	DDDEGNEDSE	7	186	DE	PDS1	Securin, inhibits anaphase by binding separin Esp1p; blocks cyclin destruction and mitotic exit, essential for meiotic progression and mitotic cell cycle arrest; localization is cell-cycle dependent and regulated by Cdc28p phosphorylation
YDR153C	DDDEFDADAD	7	217	DE	ENT5	Protein containing an N-terminal epsin-like domain involved in clathrin recruitment and traffic between the Golgi and endosomes; associates with the clathrin adaptor Gga2p, clathrin adaptor complex AP-1, and clathrin
YDR161W	EDLEELDIEE	7	373	DE	NA	Putative protein of unknown function; non-essential gene; proposed function in rRNA and ribosome biosynthesis based on transcriptional co-regulation; genetic interactions suggest a role in ER-associated protein degradation (ERAD)
YDR162C	NEDEYDDNDE	7	204	DE	NBP2	Protein involved in the HOG (high osmolarity glycerol) pathway, negatively regulates Hog1p by recruitment of phosphatase Ptc1p the Pbs2p-Hog1p complex, found in the nucleus and cytoplasm, contains an SH3 domain that binds Pbs2p
YDR167W	EEDYDAEFDD	7	3	DE	TAF10	Subunit (145 kDa) of TFIID and SAGA complexes, involved in RNA polymerase II transcription initiation and in chromatin modification
YDR172W	KEQEEEVDDE	7	239	DE	SUP35	Translation termination factor eRF3; altered protein conformation creates the [PSI(+)] prion, a dominant cytoplasmically inherited protein aggregate that alters translational fidelity and creates a nonsense suppressor phenotype
YDR211W	EEIDSEFEDE	7	533	DE	GCD6	Catalytic epsilon subunit of the translation initiation factor eIF2B, the guanine-nucleotide exchange factor for eIF2; activity subsequently regulated by phosphorylated eIF2; first identified as a negative regulator of GCN4 expression
YDR218C	SDGDYDDDDD	7	58	DE	SPR28	Sporulation-specific homolog of the yeast CDC3/10/11/12 family of bud neck microfilament genes; meiotic septin expressed at high levels during meiotic divisions and ascospore formation
YDR223W	RDDESTDEDE	7	342	DE	CRF1	Transcriptional corepressor involved in repression of ribosomal protein (RP) gene transcription via the TOR signaling pathway which promotes accumulation of Crf1p in the nucleus; role in repression of RP genes varies by strain
YDR257C	ENEEEETSEE	7	200	DE	RKM4	Ribosomal lysine methyltransferase specific for monomethylation of Rpl42ap and Rpl42bp (lysine 55); nuclear SET-domain containing protein
YDR275W	EDAYYEEEDD	7	194	DE	BSC2	Protein of unknown function, ORF exhibits genomic organization compatible with a translational readthrough-dependent mode of expression
YDR283C	DDENEDLDHD	7	732	DE	GCN2	Protein kinase, phosphorylates the alpha-subunit of translation initiation factor eIF2 (Sui2p) in response to starvation; activated by uncharged tRNAs and the Gcn1p-Gcn20p complex; contributes to DNA damage checkpoint control
YDR312W	IEEEDVEMEE	7	300	DE	SSF2	Protein required for ribosomal large subunit maturation, functionally redundant with Ssf1p; member of the Brix family
YDR314C	EEEETDDSFD	7	29	DE	RAD34	Protein involved in nucleotide excision repair (NER); homologous to RAD4
YDR334W	SESDDDMDDE	7	483	DE	SWR1	Swi2/Snf2-related ATPase that is the structural component of the SWR1 complex, which exchanges histone variant H2AZ (Htz1p) for chromatin-bound histone H2A
YDR338C	ETEDDEVDSD	7	667	DE	NA	Putative protein of unknown function, member of the multi-drug and toxin extrusion (MATE) family of the multidrug/oligosaccharidyl-lipid/polysaccharide (MOP) exporter superfamily
YDR348C	QDDHNEDEED	7	454	DE	NA	Protein of unknown function; green fluorescent protein (GFP)-fusion protein localizes to the cell periphery and bud neck; potential Cdc28p substrate
YDR363W-A	SLEEDDEFED	7	27	DE	SEM1	Component of the lid subcomplex of the regulatory subunit of the 26S proteasome; involved in mRNA export mediated by the TREX-2 complex (Sac3p-Thp1p); ortholog of human DSS1
YDR365C	NDEDEEVDME	7	400	DE	ESF1	Nucleolar protein involved in pre-rRNA processing; depletion causes severely decreased 18S rRNA levels
YDR369C	DEDDLGDIDD	7	771	DE	XRS2	Protein required for DNA repair; component of the Mre11 complex, which is involved in double strand breaks, meiotic recombination, telomere maintenance, and checkpoint signaling
YDR382W	DAAEEEKEEE	7	85	DE	RPP2B	Ribosomal protein P2 beta, a component of the ribosomal stalk, which is involved in the interaction between translational elongation factors and the ribosome; regulates the accumulation of P1 (Rpp1Ap and Rpp1Bp) in the cytoplasm
YDR383C	DEEEVEVEND	7	126	DE	NKP1	Non-essential kinetochore protein, subunit of the Ctf19 central kinetochore complex (Ctf19p-Mcm21p-Okp1p-Mcm22p-Mcm16p-Ctf3p-Chl4p-Mcm19p-Nkp1p-Nkp2p-Ame1p-Mtw1p)
YDR389W	EKEDAKDDEE	7	282	DE	SAC7	GTPase activating protein (GAP) for Rho1p, involved in signaling to the actin cytoskeleton, null mutations suppress tor2 mutations and temperature sensitive mutations in actin; potential Cdc28p substrate
YDR398W	EPVVEEDEDD	7	567	DE	UTP5	Subunit of U3-containing Small Subunit (SSU) processome complex involved in production of 18S rRNA and assembly of small ribosomal subunit
YDR409W	LEDDDDSDSD	7	443	DE	SIZ1	SUMO/Smt3 ligase that promotes the attachment of sumo (Smt3p; small ubiquitin-related modifier) to proteins; binds Ubc9p and may bind septins; specifically required for sumoylation of septins in vivo; localized to the septin ring
YDR416W	QEDEEESTDE	7	168	DE	SYF1	Member of the NineTeen Complex (NTC) that contains Prp19p and stabilizes U6 snRNA in catalytic forms of the spliceosome containing U2, U5, and U6 snRNAs; null mutant has splicing defect and arrests in G2/M; homologs in human and C. elegans
YDR420W	EDLEIEDIDD	7	1755	DE	HKR1	Mucin family member that functions as an osmosensor in the Sho1p-mediated HOG pathway with Msb2p; proposed to be a negative regulator of filamentous growth; mutant displays defects in beta-1,3 glucan synthesis and bud site selection
YDR436W	TDDDDDRGDD	7	160	DE	PPZ2	Serine/threonine protein phosphatase Z, isoform of Ppz1p; involved in regulation of potassium transport, which affects osmotic stability, cell cycle progression, and halotolerance
YDR452W	GEDSNEEDEE	7	392	DE	PPN1	Vacuolar endopolyphosphatase with a role in phosphate metabolism; functions as a homodimer
YDR456W	EEDTSDDEFD	7	494	DE	NHX1	Na+/H+ and K+/H+ exchanger, required for intracellular sequestration of Na+ and K+; located in the vacuole and late endosome compartments; required for osmotolerance to acute hypertonic shock and for vacuolar fusion
YDR468C	DDDQEEEIQD	7	33	DE	TLG1	Essential t-SNARE that forms a complex with Tlg2p and Vti1p and mediates fusion of endosome-derived vesicles with the late Golgi; binds the docking complex VFT (Vps fifty-three) through interaction with Vps51p
YDR470C	EGEEDAYDEE	7	173	DE	UGO1	Protein of unknown function; outer membrane component of the mitochondrial fusion machinery; Ugo1p bind directly to Fzo1p and Mgm1p and thereby link these two GTPases during mitochondrial fusion
YDR480W	DDADDDNDKE	7	272	DE	DIG2	MAP kinase-responsive inhibitor of the Ste12p transcription factor, involved in the regulation of mating-specific genes and the invasive growth pathway; related regulators Dig1p and Dig2p bind to Ste12p
YDR496C	DSEAEEEADE	7	63	DE	PUF6	Pumilio-homology domain protein that binds the 3' UTR of ASH1 mRNA and represses its translation, resulting in proper asymmetric localization of ASH1 mRNA; also co-sediments with the 60S ribosomal subunit and is required for its biogenesis
YDR507C	EKEEENEEKE	7	953	DE	GIN4	Protein kinase involved in bud growth and assembly of the septin ring, proposed to have kinase-dependent and kinase-independent activities; undergoes autophosphorylation; similar to Kcc4p and Hsl1p
YDR528W	EKQTDDEEEE	7	344	DE	HLR1	Protein involved in regulation of cell wall composition and integrity and response to osmotic stress; overproduction suppresses a lysis sensitive PKC mutation; similar to Lre1p, which functions antagonistically to protein kinase A
YEL012W	QEEDSDSDED	7	171	DE	UBC8	Ubiquitin-conjugating enzyme that negatively regulates gluconeogenesis by mediating the glucose-induced ubiquitination of fructose-1,6-bisphosphatase (FBPase); cytoplasmic enzyme that catalyzes the ubiquitination of histones in vitro
YEL015W	EDDEHEYDVD	7	191	DE	EDC3	Non-essential conserved protein of unknown function, plays a role in mRNA decapping by specifically affecting the function of the decapping enzyme Dcp1p; localizes to cytoplasmic mRNA processing bodies
YEL032W	DDQDDADERD	7	57	DE	MCM3	Protein involved in DNA replication; component of the Mcm2-7 hexameric complex that binds chromatin as a part of the pre-replicative complex
