id	ngram	ngram_weight	pos	stall	gene	Note
YAL011W	DDDDDDDDEE	10	33	DE	SWC3	Protein of unknown function, component of the SWR1 complex, which exchanges histone variant H2AZ (Htz1p) for chromatin-bound histone H2A; required for formation of nuclear-associated array of smooth endoplasmic reticulum known as karmellae
YBL011W	EEEEEEEEEE	10	735	DE	SCT1	Glycerol 3-phosphate/dihydroxyacetone phosphate dual substrate-specific sn-1 acyltransferase of the glycerolipid biosynthesis pathway, prefers 16-carbon fatty acids, similar to Gpt2p, gene is constitutively transcribed
YBR017C	EDDDDDDDDE	10	379	DE	KAP104	Transportin or cytosolic karyopherin beta 2; functions in the rg-nuclear localization signal-mediated nuclear import/reimport of mRNA-binding proteins Nab2p and Hrp1p; regulates asymmetric protein synthesis in daughter cells during mitosis
YBR081C	EEEEDDDDED	10	700	DE	SPT7	Subunit of the SAGA transcriptional regulatory complex, involved in proper assembly of the complex; also present as a C-terminally truncated form in the SLIK/SALSA transcriptional regulatory complex
YBR150C	DDDDDDDDDD	10	991	DE	TBS1	Putative protein of unknown function; the authentic, non-tagged protein is detected in highly purified mitochondria in high-throughput studies
YBR247C	DDEDEDEDED	10	96	DE	ENP1	Protein associated with U3 and U14 snoRNAs, required for pre-rRNA processing and 40S ribosomal subunit synthesis; localized in the nucleus and concentrated in the nucleolus
YDL058W	DEEDDEEDDE	10	1771	DE	USO1	Essential protein involved in the vesicle-mediated ER to Golgi transport step of secretion; binds membranes and functions during vesicle docking to the Golgi; required for assembly of the ER-to-Golgi SNARE complex
YDL153C	EDEEEEEEEE	10	76	DE	SAS10	Essential subunit of U3-containing Small Subunit (SSU) processome complex involved in production of 18S rRNA and assembly of small ribosomal subunit; disrupts silencing when overproduced; mutant has increased aneuploidy tolerance
YDR028C	DDEEEEDDDD	10	741	DE	REG1	Regulatory subunit of type 1 protein phosphatase Glc7p, involved in negative regulation of glucose-repressible genes
YDR068W	DDEEEEEDDD	10	252	DE	DOS2	Protein of unknown function, green fluorescent protein (GFP)-fusion protein localizes to the cytoplasm
YDR080W	DDDDDDDDDD	10	78	DE	VPS41	Vacuolar membrane protein that is a subunit of the homotypic vacuole fusion and vacuole protein sorting (HOPS) complex; essential for membrane docking and fusion at the Golgi-to-endosome and endosome-to-vacuole stages of protein transport
YDR098C	DEDDDDEEEE	10	168	DE	GRX3	Hydroperoxide and superoxide-radical responsive glutathione-dependent oxidoreductase; monothiol glutaredoxin subfamily member along with Grx4p and Grx5p; protects cells from oxidative damage
YDR170C	DEDEDEDEDE	10	95	DE	SEC7	Guanine nucleotide exchange factor (GEF) for ADP ribosylation factors involved in proliferation of the Golgi, intra-Golgi transport and ER-to-Golgi transport; found in the cytoplasm and on Golgi-associated coated vesicles
YDR186C	DDDEDDDDDD	10	481	DE	NA	Putative protein of unknown function; may interact with ribosomes, based on co-purification experiments; green fluorescent protein (GFP)-fusion protein localizes to the cytoplasm
YDR289C	DDDDDDDDDD	10	277	DE	RTT103	Protein that interacts with exonuclease Rat1p and Rai1p and plays a role in transcription termination by RNA polymerase II, has an RPR domain (carboxy-terminal domain interacting domain); also involved in regulation of Ty1 transposition
YDR299W	EDEEEEEEEE	10	97	DE	BFR2	Essential protein that is a component of 90S preribosomes; may be involved in rRNA processing; multicopy suppressor of sensitivity to Brefeldin A; expression is induced during lag phase and also by cold shock
YDR301W	DDDEEEEDED	10	150	DE	CFT1	RNA-binding subunit of the mRNA cleavage and polyadenylation factor; involved in poly(A) site recognition and required for both pre-mRNA cleavage and polyadenylation, 51% sequence similarity with mammalian AAUAA-binding subunit of CPSF
YER030W	EEDDEDEEDD	10	139	DE	CHZ1	Histone chaperone for Htz1p/H2A-H2B dimer; required for the stabilization of the Chz1p-Htz1-H2B complex; has overlapping function with Nap1p; null mutant displays weak sensitivity to MMS and benomyl; contains a highly conserved CHZ motif
YER033C	DDDDDDDDDD	10	437	DE	ZRG8	Protein of unknown function; authentic, non-tagged protein is detected in highly purified mitochondria in high-throughput studies; GFP-fusion protein is localized to the cytoplasm; transcription induced under conditions of zinc deficiency
YFL023W	EEDDEDEDEE	10	266	DE	BUD27	Unconventional prefoldin protein involved in translation initiation; mutants have inappropriate expression of nutrient sensitive genes due to translational derepression of Gcn4p transcription factor; diploid mutants show random budding
YFR016C	EEEEEEEEEE	10	467	DE	NA	Putative protein of unknown function; green fluorescent protein (GFP)-fusion protein localizes to the cytoplasm and bud; interacts with Spa2p; YFL016C is not an essential gene
YFR033C	DEDEDEDEDE	10	48	DE	QCR6	Subunit 6 of the ubiquinol cytochrome-c reductase complex, which is a component of the mitochondrial inner membrane electron transport chain; highly acidic protein; required for maturation of cytochrome c1
YFR039C	EDEDEDEDED	10	183	DE	NA	Putative protein of unknown function; may be involved in response to high salt and changes in carbon source; deletion mutant has decreased spore survival in Drosophila feces
YGL058W	DDDDDDDDDD	10	156	DE	RAD6	Ubiquitin-conjugating enzyme (E2), involved in postreplication repair (as a heterodimer with Rad18p), DSBR and checkpoint control (as a heterodimer with Bre1p), ubiquitin-mediated N-end rule protein degradation (as a heterodimer with Ubr1p
YGL150C	DEDEEDDEDE	10	141	DE	INO80	ATPase, subunit of a complex containing actin and several actin-related proteins that has chromatin remodeling activity and 3' to 5' DNA helicase activity in vitro; has a role in modulating stress gene transcription
YGL164C	EEDEEEDEEE	10	341	DE	YRB30	RanGTP-binding protein, inhibits RanGAP1 (Rna1p)-mediated GTP hydrolysis of RanGTP (Gsp1p); shares similarity to proteins in other fungi but not in higher eukaryotes
YGL203C	DDDDDDDDDE	10	566	DE	KEX1	Protease involved in the processing of killer toxin and alpha factor precursor; cleaves Lys and Arg residues from the C-terminus of peptides and proteins
YGL227W	DDDDDDDDDD	10	164	DE	VID30	Protein involved in proteasome-dependent catabolite degradation of fructose-1,6-bisphosphatase (FBPase); binds FBPase; shifts the balance of nitrogen metabolism toward glutamate production; localizes to the nucleus and the cytoplasm
YGR187C	EEEEDDDEED	10	378	DE	HGH1	Nonessential protein of unknown function; predicted to be involved in ribosome biogenesis; green fluorescent protein (GFP)-fusion protein localizes to the cytoplasm; similar to mammalian BRP16 (Brain protein 16)
YHR077C	EDEDDEDDDE	10	884	DE	NMD2	Protein involved in the nonsense-mediated mRNA decay (NMD) pathway; interacts with Nam7p and Upf3p; involved in telomere maintenance
YHR118C	EEDEDEDEEE	10	182	DE	ORC6	Subunit of the origin recognition complex, which directs DNA replication by binding to replication origins and is also involved in transcriptional silencing; phosphorylated by Cdc28p
YHR131C	EDDDDDDDDD	10	810	DE	NA	Putative protein of unknown function; green fluorescent protein (GFP)-fusion protein localizes to the cytoplasm; overexpression causes a cell cycle delay or arrest
YHR197W	DDEEEEEEEE	10	753	DE	RIX1	Essential component of the Rix1 complex (Rix1p, Ipi1p, Ipi3p) that is required for processing of ITS2 sequences from 35S pre-rRNA; Rix1 complex associates with Mdn1p in pre-60S ribosomal particles
YIR016W	DDDDDDEDDD	10	89	DE	NA	Putative protein of unknown function; expression directly regulated by the metabolic and meiotic transcriptional regulator Ume6p; overexpression causes a cell cycle delay or arrest; YIR016W is a non-essential gene
YJL115W	DDEEEEDDEE	10	169	DE	ASF1	Nucleosome assembly factor, involved in chromatin assembly and disassembly, anti-silencing protein that causes derepression of silent loci when overexpressed; plays a role in regulating Ty1 transposition
YJL123C	EEEEEEEEEE	10	125	DE	MTC1	Protein of unknown function that may interact with ribosomes; green fluorescent protein (GFP)-fusion protein localizes to the cytoplasm and to COPI-coated vesicles (early Golgi); mtc1 is synthetically lethal with cdc13-1
YKL028W	EEEEEEEEEE	10	373	DE	TFA1	TFIIE large subunit, involved in recruitment of RNA polymerase II to the promoter, activation of TFIIH, and promoter opening
YKL088W	EDDDDEDDEE	10	526	DE	CAB3	Subunit of a phosphopantothenoylcysteine decarboxylase (PPCDC; Cab3p, Sis2p, Vhs3p) complex, which catalyzes the third step of coenzyme A biosynthesis; null mutant lethality is complemented by E. coli coaBC
YKL105C	DDDDDDDDDD	10	630	DE	NA	Putative protein of unknown function
YKL172W	EEEEEEEEEE	10	114	DE	EBP2	Essential protein required for the maturation of 25S rRNA and 60S ribosomal subunit assembly, localizes to the nucleolus; constituent of 66S pre-ribosomal particles
YKR048C	DEDEDEEEDD	10	376	DE	NAP1	Protein that interacts with mitotic cyclin Clb2p; required for the regulation of microtubule dynamics during mitosis; controls bud morphogenesis; involved in the transport of H2A and H2B histones to the nucleus; phosphorylated by CK2
YKR072C	EEEDDDEDEE	10	495	DE	SIS2	Negative regulatory subunit of protein phosphatase 1 Ppz1p and also a subunit of the phosphopantothenoylcysteine decarboxylase (PPCDC; Cab3p, Sis2p, Vhs3p) complex, which catalyzes the third step of coenzyme A biosynthesis
YLR025W	EEEEDEEDED	10	217	DE	SNF7	One of four subunits of the endosomal sorting complex required for transport III (ESCRT-III); involved in the sorting of transmembrane proteins into the multivesicular body (MVB) pathway; recruited from the cytoplasm to endosomal membranes
YLR055C	EDEEDDDDDD	10	42	DE	SPT8	Subunit of the SAGA transcriptional regulatory complex but not present in SAGA-like complex SLIK/SALSA, required for SAGA-mediated inhibition at some promoters
YLR223C	EEEEEDDDED	10	131	DE	IFH1	Coactivator that regulates transcription of ribosomal protein (RP) genes; recruited to RP gene promoters during optimal growth conditions via Fhl1p; subunit of CURI, a complex that coordinates RP production and pre-rRNA processing
YLR403W	DDDDDDDDDD	10	544	DE	SFP1	Transcription factor that controls expression of ribosome biogenesis genes in response to nutrients and stress, regulates G2/M transitions during mitotic cell cycle and DNA-damage response, modulates cell size; regulated by TORC1 and Mrs6p
YLR449W	EEEEEEEEED	10	190	DE	FPR4	Peptidyl-prolyl cis-trans isomerase (PPIase) (proline isomerase) localized to the nucleus; catalyzes isomerization of proline residues in histones H3 and H4, which affects lysine methylation of those histones
YLR451W	DEEEEEDEDE	10	677	DE	LEU3	Zinc-finger transcription factor that regulates genes involved in branched chain amino acid biosynthesis and ammonia assimilation; positively regulated by alpha-isopropylmalate, an intermediate in leucine biosynthesis
YML010W	DEDDDEDDDD	10	147	DE	SPT5	Protein involved in regulating Pol I and Pol II transcription and pre-mRNA processing; forms a complex with Spt4p; contains a C-terminal repeat domain that is a target for phosphorylation by Sgv1p
YML034W	DDDDDDDDDD	10	116	DE	SRC1	Inner nuclear membrane protein that functions in regulation of subtelomeric genes and is linked to TREX (transcription export) factors; SRC1 produces 2 splice variant proteins with different functions; mutant has aneuploidy tolerance
YML049C	EEEEEEEEDD	10	789	DE	RSE1	Protein involved in pre-mRNA splicing; component of the pre-spliceosome; associates with U2 snRNA; involved in ER to Golgi transport
YML059C	DEEDEEEDDD	10	282	DE	NTE1	Serine esterase, homolog of human neuropathy target esterase (NTE); Nte1p-mediated phosphatidylcholine turnover influences transcription factor Opi1p localization, affecting transcriptional regulation of phospholipid biosynthesis genes
YML065W	EEEEDEEEDE	10	282	DE	ORC1	Largest subunit of the origin recognition complex, which directs DNA replication by binding to replication origins and is also involved in transcriptional silencing; exhibits ATPase activity
YML074C	EDDEEDDDED	10	104	DE	FPR3	Nucleolar peptidyl-prolyl cis-trans isomerase (PPIase); FK506 binding protein; phosphorylated by casein kinase II (Cka1p-Cka2p-Ckb1p-Ckb2p) and dephosphorylated by Ptp1p
YML119W	DEDEEDEEED	10	324	DE	NA	Putative protein of unknown function; YML119W is not an essential gene; potential Cdc28p substrate
YMR043W	DDEEEDEEED	10	97	DE	MCM1	Transcription factor involved in cell-type-specific transcription and pheromone response; plays a central role in the formation of both repressor and activator complexes
YMR131C	EDDEEDDEDD	10	186	DE	RRB1	Essential nuclear protein involved in early steps of ribosome biogenesis; physically interacts with the ribosomal protein Rpl3p
YMR227C	EEEEEEEEEE	10	516	DE	TAF7	TFIID subunit (67 kDa), involved in RNA polymerase II transcription initiation
YMR235C	EDEEDEDEDE	10	365	DE	RNA1	GTPase activating protein (GAP) for Gsp1p, involved in nuclear transport
YNL049C	EEEDEDEEEE	10	310	DE	SFB2	Component of the Sec23p-Sfb2p heterodimer of the COPII vesicle coat, required for cargo selection during vesicle formation in ER to Golgi transport; homologous to Sec24p and Sfb3p
YNL099C	EDEDEEEDDD	10	30	DE	OCA1	Putative protein tyrosine phosphatase, required for cell cycle arrest in response to oxidative damage of DNA
YNL144C	DEDDDEDEDD	10	555	DE	NA	Putative protein of unknown function; the authentic, non-tagged protein is detected in highly purified mitochondria in high-throughput studies; YNL144C is not an essential gene
YNL151C	EEDEDEEDDD	10	213	DE	RPC31	RNA polymerase III subunit C31
YNL206C	EEDDEEDDEE	10	384	DE	RTT106	Histone chaperone, involved in regulation of chromatin structure in both transcribed and silenced chromosomal regions; affects transcriptional elongation; has a role in regulation of Ty1 transposition
YNL308C	EDEEEDEEEE	10	52	DE	KRI1	Essential nucleolar protein required for 40S ribosome biogenesis; physically and functionally interacts with Krr1p
YOL054W	DDEDDEEEDE	10	257	DE	PSH1	E3 ubiquitin ligase that mediates poyubiquitination and degradation of centromere-binding protein Cse4p and prevents Cse4p from mislocalizing to euchromatin; ubiquitylation of Cse4p may be antagonized by Scm3p
YOL078W	EEEDDDDDDD	10	241	DE	AVO1	Component of a membrane-bound complex containing the Tor2p kinase and other proteins, which may have a role in regulation of cell growth
YOL138C	DDDDDDDDDD	10	755	DE	RTC1	Protein of unknown function; may interact with ribosomes, based on co-purification experiments; null mutation suppresses cdc13-1 temperature sensitivity
YOR054C	DDDDDDDDDD	10	605	DE	VHS3	Negative regulatory subunit of protein phosphatase 1 Ppz1p and also a subunit of the phosphopantothenoylcysteine decarboxylase (PPCDC; Cab3p, Sis2p, Vhs3p) complex, which catalyzes the third step of coenzyme A biosynthesis
YOR211C	DDDDEDDDDE	10	160	DE	MGM1	Mitochondrial GTPase, present in complex with Ugo1p and Fzo1p; required for mt morphology and genome maintenance; exists as long and short form with different distributions; homolog of human OPA1 involved in autosomal dominant optic atrophy
YPL009C	DDDEEEEEEE	10	716	DE	TAE2	Protein of unknown function, involved in protein translation; may interact with ribosomes, based on co-purification experiments; green fluorescent protein (GFP)-fusion protein localizes to the cytoplasm
YPL158C	DEEEEEDEDD	10	650	DE	AIM44	Protein of unknown function; GFP-fusion protein localizes to the bud neck; transcription is regulated by Swi5p; null mutant displays elevated frequency of mitochondrial genome loss
YPL190C	EEEEEEEEDD	10	107	DE	NAB3	Single stranded RNA binding protein; acidic ribonucleoprotein; required for termination of non-poly(A) transcripts and efficient splicing; interacts with Nrd1p
YPR018W	EEEEEEEDDE	10	405	DE	RLF2	Largest subunit (p90) of the Chromatin Assembly Complex (CAF-1) with Cac2p and Msi1p that assembles newly synthesized histones onto recently replicated DNA; involved in the maintenance of transcriptionally silent chromatin
YPR075C	DDEDDDDEDD	10	146	DE	OPY2	Integral membrane protein that functions in the signaling branch of the high-osmolarity glycerol (HOG) pathway; interacts with Ste50p; overproduction blocks cell cycle arrest in the presence of mating pheromone
YPR143W	EEDDDEEEED	10	71	DE	RRP15	Nucleolar protein, constituent of pre-60S ribosomal particles; required for proper processing of the 27S pre-rRNA at the A3 and B1 sites to yield mature 5.8S and 25S rRNAs
YPR148C	EEDEEDEEDE	10	195	DE	NA	Protein of unknown function that may interact with ribosomes, based on co-purification experiments; green fluorescent protein (GFP)-fusion protein localizes to the cytoplasm in a punctate pattern
YPR152C	EEDEEEDEEE	10	176	DE	URN1	Putative protein of unknown function containing WW and FF domains; overexpression causes accumulation of cells in G1 phase
YAL019W	EDDDYEEEDE	9	500	DE	FUN30	Conserved member of the Snf2p family with ATP-dependent chromatin remodeling activity; has a role in silencing; potential Cdc28p substrate; authentic, non-tagged protein is detected in purified mitochondria in high-throughput studies
YAL025C	DEEEDWDEEE	9	200	DE	MAK16	Essential nuclear protein, constituent of 66S pre-ribosomal particles; required for maturation of 25S and 5.8S rRNAs; required for maintenance of M1 satellite double-stranded RNA of the L-A virus
YAL035W	EEEEEGEEEE	9	356	DE	FUN12	GTPase, required for general translation initiation by promoting Met-tRNAiMet binding to ribosomes and ribosomal subunit joining; homolog of bacterial IF2
YAR042W	DDDDYDDDDE	9	463	DE	SWH1	Protein similar to mammalian oxysterol-binding protein; contains ankyrin repeats; localizes to the Golgi and the nucleus-vacuole junction
YBL046W	DDEDDDDNDD	9	263	DE	PSY4	Putative regulatory subunit of an evolutionarily conserved protein phosphatase; localization is cell-cycle dependent and regulated by Cdc28p phosphorylation; required for cisplatin resistance; homolog of mammalian R2
YBL074C	DEERDDEDDE	9	331	DE	AAR2	Component of the U5 snRNP, required for splicing of U3 precursors; originally described as a splicing factor specifically required for splicing pre-mRNA of the MATa1 cistron
YBR030W	ESEEEEEEEE	9	417	DE	RKM3	Ribosomal lysine methyltransferase specific for monomethylation of Rpl42ap and Rpl42bp (lysine 40); nuclear SET domain containing protein
YBR129C	DYDEEEDDDD	9	162	DE	OPY1	Protein of unknown function, overproduction blocks cell cycle arrest in the presence of mating pheromone; the authentic, non-tagged protein is detected in highly purified mitochondria in high-throughput studies
YBR215W	DDDEDMEEDE	9	527	DE	HPC2	Subunit of the HIR complex, a nucleosome assembly complex involved in regulation of histone gene transcription; mutants display synthetic defects with subunits of FACT, a complex that allows passage of RNA Pol II through nucleosomes
YBR279W	VDEEDDEDEE	9	360	DE	PAF1	Component of the Paf1p complex that binds to and modulates the activity of RNA polymerases I and II; required for expression of a subset of genes, including cell cycle-regulated genes; homolog of human PD2/hPAF1
YCR042C	DEEEEEGEEE	9	318	DE	TAF2	TFIID subunit (150 kDa), involved in RNA polymerase II transcription initiation
YCR088W	DDDWDDDEDE	9	435	DE	ABP1	Actin-binding protein of the cortical actin cytoskeleton, important for activation of the Arp2/3 complex that plays a key role actin in cytoskeleton organization
YCR092C	EDDEEEGEED	9	108	DE	MSH3	Mismatch repair protein, forms dimers with Msh2p that mediate repair of insertion or deletion mutations and removal of nonhomologous DNA ends, contains a PCNA (Pol30p) binding motif required for genome stability
YDR054C	EFEDDDDDDD	9	251	DE	CDC34	Ubiquitin-conjugating enzyme (E2) and catalytic subunit of SCF ubiquitin-protein ligase complex (together with Skp1p, Rbx1p, Cdc53p, and an F-box protein) that regulates cell cycle progression by targeting key substrates for degradation
YDR087C	DGDEDDEDEE	9	186	DE	RRP1	Essential evolutionarily conserved nucleolar protein necessary for biogenesis of 60S ribosomal subunits and processing of pre-rRNAs to mature rRNAs, associated with several distinct 66S pre-ribosomal particles
YDR103W	DEHDDDDEED	9	775	DE	STE5	Pheromone-response scaffold protein that controls the mating decision; binds Ste11p, Ste7p, and Fus3p kinases, forming a MAPK cascade complex that interacts with the plasma membrane and Ste4p-Ste18p; allosteric activator of Fus3p
YDR152W	EEDNEEDEDE	9	86	DE	GIR2	Highly-acidic cytoplasmic RWD domain-containing protein of unknown function; forms a complex with Rbg2p; interacts with Rbg1p and Gcn1p; associates with translating ribosomes; putative intrinsically unstructured protein
YDR169C	EDEDEEFDED	9	211	DE	STB3	Ribosomal RNA processing element (RRPE)-binding protein involved in the glucose-induced transition from quiescence to growth; restricted to nucleus in quiescent cells, released into cytoplasm after glucose repletion; binds Sin3p
YDR173C	DDDDDDDDND	9	285	DE	ARG82	Inositol polyphosphate multikinase (IPMK), sequentially phosphorylates Ins(1,4,5)P3 to form Ins(1,3,4,5,6)P5; also has diphosphoinositol polyphosphate synthase activity; regulates arginine-, phosphate-, and nitrogen-responsive genes
YDR324C	NDEEDDEDDD	9	688	DE	UTP4	Subunit of U3-containing 90S preribosome and Small Subunit (SSU) processome complexes involved in production of 18S rRNA and assembly of small ribosomal subunit; member of t-Utp subcomplex involved with transcription of 35S rRNA transcript
YDR328C	GDDDDEDDDE	9	64	DE	SKP1	Evolutionarily conserved kinetochore protein that is part of multiple protein complexes, including the SCF ubiquitin ligase complex, the CBF3 complex that binds centromeric DNA, and the RAVE complex that regulates assembly of the V-ATPase
YDR333C	DDDDDDEEFD	9	119	DE	NA	Putative protein of unknown function
YDR346C	DEDDNEDEDE	9	212	DE	SVF1	Protein with a potential role in cell survival pathways, required for the diauxic growth shift; expression in mammalian cells increases survival under conditions inducing apoptosis; mutant has increased aneuploidy tolerance
YDR457W	EDIEEDDDDD	9	1909	DE	TOM1	E3 ubiquitin ligase of the hect-domain class; has a role in mRNA export from the nucleus and may regulate transcriptional coactivators; involved in degradation of excess histones
YDR473C	DEVDDDDDDE	9	200	DE	PRP3	Splicing factor, component of the U4/U6-U5 snRNP complex
YER002W	DEDEDEDEGE	9	84	DE	NOP16	Constituent of 66S pre-ribosomal particles, involved in 60S ribosomal subunit biogenesis
YER075C	CDDDDDDDDD	9	722	DE	PTP3	Phosphotyrosine-specific protein phosphatase involved in the inactivation of mitogen-activated protein kinase (MAPK) during osmolarity sensing; dephosporylates Hog1p MAPK and regulates its localization; localized to the cytoplasm
YER164W	EDDEDEFEDE	9	56	DE	CHD1	Nucleosome remodeling factor that functions in regulation of transcription elongation; contains a chromo domain, a helicase domain and a DNA-binding domain; component of both the SAGA and SLIK complexes
YER174C	DDEEDETEEE	9	134	DE	GRX4	Hydroperoxide and superoxide-radical responsive glutathione-dependent oxidoreductase; monothiol glutaredoxin subfamily member along with Grx3p and Grx5p; protects cells from oxidative damage; mutant has increased aneuploidy tolerance
YFL021W	DDDDDDDDVE	9	150	DE	GAT1	Transcriptional activator of genes involved in nitrogen catabolite repression; contains a GATA-1-type zinc finger DNA-binding motif; activity and localization regulated by nitrogen limitation and Ure2p
YFL034C-A	EDADEEEDDE	9	108	DE	RPL22B	Protein component of the large (60S) ribosomal subunit, has similarity to Rpl22Ap and to rat L22 ribosomal protein
YGL066W	DDDDDDDNDD	9	140	DE	SGF73	SAGA complex subunit with a role in anchoring the deubiquitination module into SAGA and SLIK complexes; involved in preinitiation complex assembly at promoters; human ortholog ataxin-7 is associated with spinocerebellar ataxia diseases
YGL244W	DNEDEDDEED	9	181	DE	RTF1	Subunit of the RNA polymerase II-associated Paf1 complex; directly or indirectly regulates DNA-binding properties of Spt15p and relative activities of different TATA elements; involved in telomere maintenance
YGR013W	EDEDEEDDTE	9	342	DE	SNU71	Component of U1 snRNP required for mRNA splicing via spliceosome; yeast specific, no metazoan counterpart
YGR071C	HEEEDEEEDD	9	33	DE	NA	Putative protein of unknown function; deletion mutant has increased glycogen accumulation and displays elongated buds; green fluorescent protein (GFP)-fusion protein localizes to the nucleus
YGR086C	EEGEEEEEED	9	283	DE	PIL1	Primary component of eisosomes, which are large immobile cell cortex structures associated with endocytosis; null mutants show activation of Pkc1p/Ypk1p stress resistance pathways; detected in phosphorylated state in mitochondria
YGR103W	GEEDDDDDEE	9	499	DE	NOP7	Component of several different pre-ribosomal particles; forms a complex with Ytm1p and Erb1p that is required for maturation of the large ribosomal subunit; required for exit from G0 and the initiation of cell proliferation
YGR116W	EEDEDIDEDE	9	40	DE	SPT6	Transcription elongation factor required for the maintenance of chromatin structure during transcription in order to inhibit transcription from promoters within the coding region
YGR159C	DEEEEEEKEE	9	97	DE	NSR1	Nucleolar protein that binds nuclear localization sequences, required for pre-rRNA processing and ribosome biogenesis
YGR270W	EEDVDDDEEE	9	127	DE	YTA7	Protein that localizes to chromatin and has a role in regulation of histone gene expression; has a bromodomain-like region that interacts with the N-terminal tail of histone H3, and an ATPase domain; potentially phosphorylated by Cdc28p
