id	ngram	ngram_weight	pos	stall	gene	Note
YJR140C	DRESERQEEE	6	305	DE	HIR3	Subunit of the HIR complex, a nucleosome assembly complex involved in regulation of histone gene transcription; involved in position-dependent gene silencing and nucleosome reassembly
YJR160C	EDAKEADESE	6	72	DE	MPH3	Alpha-glucoside permease, transports maltose, maltotriose, alpha-methylglucoside, and turanose; identical to Mph2p; encoded in a subtelomeric position in a region likely to have undergone duplication
YKL005C	RTDEVDEADE	6	60	DE	BYE1	Negative regulator of transcription elongation, contains a TFIIS-like domain and a PHD finger, multicopy suppressor of temperature-sensitive ess1 mutations, probably binds RNA polymerase II large subunit
YKL014C	WEFIKDEEEE	6	1332	DE	URB1	Nucleolar protein required for the normal accumulation of 25S and 5.8S rRNAs, associated with the 27SA2 pre-ribosomal particle; proposed to be involved in the biogenesis of the 60S ribosomal subunit
YKL017C	DATPSEDDDD	6	505	DE	HCS1	Hexameric DNA polymerase alpha-associated DNA helicase A involved in lagging strand DNA synthesis; contains single-stranded DNA stimulated ATPase and dATPase activities; replication protein A stimulates helicase and ATPase activities
YKL020C	KEDEGELRDD	6	69	DE	SPT23	ER membrane protein involved in regulation of OLE1 transcription, acts with homolog Mga2p; inactive ER form dimerizes and one subunit is then activated by ubiquitin/proteasome-dependent processing followed by nuclear targeting
YKL022C	VVRDEDNDED	6	173	DE	CDC16	Subunit of the anaphase-promoting complex/cyclosome (APC/C), which is a ubiquitin-protein ligase required for degradation of anaphase inhibitors, including mitotic cyclins, during the metaphase/anaphase transition; required for sporulation
YKL040C	KFELTEEDEE	6	142	DE	NFU1	Protein involved in iron metabolism in mitochondria; similar to NifU, which is a protein required for the maturation of the Fe/S clusters of nitrogenase in nitrogen-fixing bacteria
YKL049C	DLDIETDYED	6	66	DE	CSE4	Centromere protein that resembles histone H3, required for proper kinetochore function; homolog of human CENP-A; levels are regulated by E3 ubiquitin ligase Psh1p
YKL050C	EVTDDQDDQE	6	887	DE	NA	Protein of unknown function; the YKL050W protein is a target of the SCFCdc4 ubiquitin ligase complex and YKL050W transcription is regulated by Azf1p
YKL052C	DDNNEGPDEE	6	263	DE	ASK1	Essential subunit of the Dam1 complex (aka DASH complex), couples kinetochores to the force produced by MT depolymerization thereby aiding in chromosome segregation; phosphorylated during the cell cycle by cyclin-dependent kinases
YKL054C	EEETAEPSEE	6	299	DE	DEF1	RNAPII degradation factor, forms a complex with Rad26p in chromatin, enables ubiquitination and proteolysis of RNAPII present in an elongation complex; mutant is deficient in Zip1p loading onto chromosomes during meiosis
YKL056C	AEGGDDDVEE	6	49	DE	TMA19	Protein that associates with ribosomes; homolog of translationally controlled tumor protein; green fluorescent protein (GFP)-fusion protein localizes to the cytoplasm and relocates to the mitochondrial outer surface upon oxidative stress
YKL060C	LDLSEETDEE	6	143	DE	FBA1	Fructose 1,6-bisphosphate aldolase, required for glycolysis and gluconeogenesis; catalyzes conversion of fructose 1,6 bisphosphate to glyceraldehyde-3-P and dihydroxyacetone-P; locates to mitochondrial outer surface upon oxidative stress
YKL061W	KDDVELDDVE	6	53	DE	BLI1	Putative protein of unknown function; likely member of BLOC complex involved in endosomal cargo sorting; green fluorescent protein (GFP)-fusion protein localizes to the endosome
YKL064W	SSDSNDEEDE	6	231	DE	MNR2	Vacuolar membrane protein required for magnesium homeostasis; putative magnesium transporter; has similarity to Alr1p and Alr2p, which mediate influx of Mg2+ and other divalent cations
YKL068W-A	QTQEEIEDED	6	37	DE	NA	Putative protein of unknown function; identified by homology to Ashbya gossypii
YKL074C	IDEDDFDMME	6	512	DE	MUD2	Protein involved in early pre-mRNA splicing; component of the pre-mRNA-U1 snRNP complex, the commitment complex; interacts with Msl5p/BBP splicing factor and Sub2p; similar to metazoan splicing factor U2AF65
YKL093W	EACDTEDADE	6	43	DE	MBR1	Protein involved in mitochondrial functions and stress response; overexpression suppresses growth defects of hap2, hap3, and hap4 mutants
YKL099C	DEEDESLSMD	6	84	DE	UTP11	Subunit of U3-containing Small Subunit (SSU) processome complex involved in production of 18S rRNA and assembly of small ribosomal subunit
YKL140W	DEDNENEHQD	6	496	DE	TGL1	Steryl ester hydrolase, one of three gene products (Yeh1p, Yeh2p, Tgl1p) responsible for steryl ester hydrolase activity and involved in sterol homeostasis; localized to lipid particle membranes
YKL149C	DLDLSSDEDE	6	264	DE	DBR1	RNA lariat debranching enzyme, involved in intron turnover; required for efficient Ty1 transposition
YKL150W	DDKQDDQDFD	6	226	DE	MCR1	Mitochondrial NADH-cytochrome b5 reductase, involved in ergosterol biosynthesis
YKL174C	HEDDSQENEE	6	31	DE	TPO5	Protein involved in excretion of putrescine and spermidine; putative polyamine transporter in the Golgi or post-Golgi vesicles
YKL178C	DKETDDILDE	6	385	DE	STE3	Receptor for a factor pheromone, couples to MAP kinase cascade to mediate pheromone response; transcribed in alpha cells and required for mating by alpha cells, ligand bound receptors endocytosed and recycled to the plasma membrane; GPCR
YKL187C	LGDDDDADFE	6	686	DE	NA	Putative protein of unknown function; the authentic, non-tagged protein is detected in a phosphorylated state in highly purified mitochondria in high-throughput studies
YKL188C	ETAVDREEDE	6	60	DE	PXA2	Subunit of a heterodimeric peroxisomal ATP-binding cassette transporter complex (Pxa1p-Pxa2p), required for import of long-chain fatty acids into peroxisomes; similarity to human adrenoleukodystrophy transporter and ALD-related proteins
YKL191W	LELEAADDDD	6	450	DE	DPH2	Protein required, along with Dph1p, Kti11p, Jjj3p, and Dph5p, for synthesis of diphthamide, which is a modified histidine residue of translation elongation factor 2 (Eft1p or Eft2p); may act in a complex with Dph1p and Kti11p
YKL192C	EEEFDIEIPD	6	92	DE	ACP1	Mitochondrial matrix acyl carrier protein, involved in biosynthesis of octanoate, which is a precursor to lipoic acid; activated by phosphopantetheinylation catalyzed by Ppt2p
YKL194C	VETTDEEKEE	6	115	DE	MST1	Mitochondrial threonyl-tRNA synthetase
YKL195W	SESSDEEKEE	6	253	DE	MIA40	Essential protein of the mitochondrial intermembrane space (IMS); promotes retention of newly imported proteins; may do so by stabilizing client protein folding as part of a disulfide relay system or transferring metal to client proteins
YKL201C	EEEEKKKKEE	6	1045	DE	MNN4	Putative positive regulator of mannosylphosphate transferase (Mnn6p), involved in mannosylphosphorylation of N-linked oligosaccharides; expression increases in late-logarithmic and stationary growth phases
YKL204W	DDEEKKIDQE	6	200	DE	EAP1	eIF4E-associated protein, competes with eIF4G for binding to eIF4E; inhibits cap-dependent translation; functions independently of eIF4E to maintain genetic stability; plays a role in cell growth, implicated in the TOR signaling cascade
YKL205W	DDEVTQDDFE	6	431	DE	LOS1	Nuclear pore protein involved in nuclear export of pre-tRNA and in re-export of mature tRNAs after their retrograde import from the cytoplasm
YKL210W	EPVDFEKDDD	6	816	DE	UBA1	Ubiquitin activating enzyme (E1), involved in ubiquitin-mediated protein degradation and essential for viability
YKR007W	EEGGDSREDE	6	98	DE	MEH1	Component of the EGO complex, which is involved in the regulation of microautophagy, and of the GSE complex, which is required for proper sorting of amino acid permease Gap1p; loss results in a defect in vacuolar acidification
YKR010C	EDADYEPADE	6	312	DE	TOF2	Protein required for rDNA silencing and mitotic rDNA condensation; stimulates Cdc14p phosphatase activity and biphasic release to promote rDNA repeat segregation; required for condensin recruitment to the replication fork barrier site
YKR017C	DSEFDINEDE	6	48	DE	NA	Putative protein of unknown function; contains a RING finger motif
YKR019C	DDTDSDSESD	6	391	DE	IRS4	EH domain-containing protein involved in regulating phosphatidylinositol 4,5-bisphosphate levels and autophagy; Irs4p and Tax4p bind and activate the PtdIns phosphatase Inp51p; Irs4p and Tax4p are involved in localizing Atg17p to the PAS
YKR020W	DDELSATEED	6	73	DE	VPS51	Component of the GARP (Golgi-associated retrograde protein) complex, Vps51p-Vps52p-Vps53p-Vps54p, which is required for the recycling of proteins from endosomes to the late Golgi; links the (VFT/GARP) complex to the SNARE Tlg1p
YKR022C	SNDSEDDDND	6	36	DE	NTR2	Essential protein that forms a dimer with Ntr1p; also forms a trimer, with Ntr2p and the DExD/H-box RNA helicase Prp43p, that is involved in spliceosome disassembly
YKR023W	EEKEESEAKE	6	299	DE	NA	Putative protein of unknown function; the authentic, non-tagged protein is detected in highly purified mitochondria in high-throughput studies
YKR035W-A	EVNVDDEKED	6	183	DE	DID2	Class E protein of the vacuolar protein-sorting (Vps) pathway; binds Vps4p and directs it to dissociate ESCRT-III complexes; forms a functional and physical complex with Ist1p; human ortholog may be altered in breast tumors
YKR041W	DDDYMNSDDD	6	2	DE	NA	Putative protein of unknown function; green fluorescent protein (GFP)-fusion protein localizes to the cytoplasm and nucleus
YKR050W	DDENITHEDD	6	696	DE	TRK2	Component of the Trk1p-Trk2p potassium transport system
YKR051W	ESIEESWEDD	6	364	DE	NA	Putative protein of unknown function
YKR075C	DEDSEDLMNE	6	206	DE	NA	Protein of unknown function; similar to YOR062Cp and Reg1p; expression regulated by glucose and Rgt1p; GFP-fusion protein is induced in response to the DNA-damaging agent MMS
YKR084C	DFHDEGEFDD	6	14	DE	HBS1	GTPase with similarity to translation release factors; together with binding partner Dom34p, facilitates ribosomal subunit dissociation and peptidyl-tRNA release when translation is stalled; genetically implicated in mRNA no-go decay
YKR088C	EDDEFDGYFE	6	15	DE	TVP38	Integral membrane protein localized to late Golgi vesicles along with the v-SNARE Tlg2p; required for asymmetric localization of Kar9p during mitosis; GFP-fusion protein localizes to the cytoplasm in a punctate pattern
YKR089C	NEDKLDDDQE	6	86	DE	TGL4	Multifunctional triacylglycerol lipase, steryl ester hydrolase, and Ca2+-independent phospholipase A2; catalyzes acyl-CoA dependent acylation of LPA to PA; required with Tgl3p for timely bud formation; phosphorylated and activated by Cdc28p
YKR091W	EEENDDSVRE	6	110	DE	SRL3	Cytoplasmic protein that, when overexpressed, suppresses the lethality of a rad53 null mutation; potential Cdc28p substrate
YKR096W	DDSNEREEND	6	251	DE	NA	Protein of unknown function that may interact with ribosomes, based on co-purification experiments; green fluorescent protein (GFP)-fusion protein localizes to the nucleus and cytoplasm; predicted to contain a PINc domain
YKR098C	ERMDEENYEE	6	704	DE	UBP11	Ubiquitin-specific protease that cleaves ubiquitin from ubiquitinated proteins
YKR100C	REEQDDRELE	6	36	DE	SKG1	Transmembrane protein with a role in cell wall polymer composition; localizes on the inner surface of the plasma membrane at the bud and in the daughter cell
YKR105C	DDTPEDNLED	6	571	DE	VBA5	Putative transporter of the Major Facilitator Superfamily (MFS); proposed role as a basic amino acid permease based on phylogeny
YLL001W	VEESLDKEED	6	286	DE	DNM1	Dynamin-related GTPase required for mitochondrial fission and morphology; assembles on the cytoplasmic face of mitochondrial tubules at sites at which division will occur; also participates in endocytosis and regulating peroxisome abundance
YLL003W	EELADEVREE	6	708	DE	SFI1	Centrin (Cdc31p)-binding protein required for spindle pole body (SPB) duplication, localizes to the half-bridge of the SPB, required for progression through G(2)-M transition, has similarity to Xenopus laevis XCAP-C
YLL004W	YEDINDEDGD	6	163	DE	ORC3	Subunit of the origin recognition complex, which directs DNA replication by binding to replication origins and is also involved in transcriptional silencing
YLL019C	SRVDEDADDD	6	114	DE	KNS1	Nonessential putative protein kinase of unknown cellular role; member of the LAMMER family of protein kinases, which are serine/threonine kinases also capable of phosphorylating tyrosine residues
YLL024C	EAEKFKEEDE	6	517	DE	SSA2	ATP binding protein involved in protein folding and vacuolar import of proteins; member of heat shock protein 70 (HSP70) family; associated with the chaperonin-containing T-complex; present in the cytoplasm, vacuolar membrane and cell wall
YLL026W	DENVPEEAEE	6	865	DE	HSP104	Heat shock protein that cooperates with Ydj1p (Hsp40) and Ssa1p (Hsp70) to refold and reactivate previously denatured, aggregated proteins; responsive to stresses including: heat, ethanol, and sodium arsenite; involved in [PSI+] propagation
YLL032C	IQLEMEEEDD	6	446	DE	NA	Protein of unknown function that may interact with ribosomes, based on co-purification experiments; green fluorescent protein (GFP)-fusion protein localizes to the cytoplasm; YLL032C is not an essential gene
YLL038C	DPLAEEDSED	6	214	DE	ENT4	Protein of unknown function, contains an N-terminal epsin-like domain; proposed to be involved in the trafficking of Arn1p in the absence of ferrichrome
YLL043W	DDDYDYEMQD	6	73	DE	FPS1	Plasma membrane channel, member of major intrinsic protein (MIP) family; involved in efflux of glycerol and in uptake of acetic acid and the trivalent metalloids arsenite and antimonite; phosphorylated by Hog1p MAPK under acetate stress
YLR005W	VISESEEDED	6	4	DE	SSL1	Component of the core form of RNA polymerase transcription factor TFIIH, which has both protein kinase and DNA-dependent ATPase/helicase activities and is essential for transcription and nucleotide excision repair; interacts with Tfb4p
YLR006C	ELKDEEKDAE	6	369	DE	SSK1	Cytoplasmic response regulator, part of a two-component signal transducer that mediates osmosensing via a phosphorelay mechanism; dephosphorylated form is degraded by the ubiquitin-proteasome system; potential Cdc28p substrate
YLR014C	DSGDDVLDED	6	242	DE	PPR1	Zinc finger transcription factor containing a Zn(2)-Cys(6) binuclear cluster domain, positively regulates transcription of genes involved in uracil biosynthesis; activity may be modulated by interaction with Tup1p
YLR016C	SEFEEDNDYE	6	188	DE	PML1	Subunit of the RES complex, which is required for nuclear retention of unspliced pre-mRNAs; acts in the same pathway as Pml39p and Mlp1p
YLR020C	DIEEFEVETD	6	159	DE	YEH2	Steryl ester hydrolase, catalyzes steryl ester hydrolysis at the plasma membrane; involved in sterol metabolism
YLR032W	GEAMDTDEDE	6	1145	DE	RAD5	DNA helicase proposed to promote replication fork regression during postreplication repair by template switching; RING finger containing ubiquitin ligase; stimulates the synthesis of free and PCNA-bound polyubiquitin chains by Ubc13p-Mms2p
YLR045C	EEEDVRRKED	6	795	DE	STU2	Microtubule-associated protein (MAP) of the XMAP215/Dis1 family; regulates microtubule dynamics during spindle orientation and metaphase chromosome alignment; interacts with spindle pole body component Spc72p
YLR052W	EQDQETEDPD	6	145	DE	IES3	Subunit of the INO80 chromatin remodeling complex
YLR060W	MEMDEDTTEE	6	32	DE	FRS1	Beta subunit of cytoplasmic phenylalanyl-tRNA synthetase, forms a tetramer with Frs2p to generate active enzyme; able to hydrolyze mis-aminoacylated tRNA-Phe, which could contribute to translational quality control
YLR086W	EDELRELDVE	6	1192	DE	SMC4	Subunit of the condensin complex; reorganizes chromosomes during cell division; forms a complex with Smc2p that has ATP-hydrolyzing and DNA-binding activity; required for tRNA gene clustering at the nucleolus; potential Cdc28p substrate
YLR092W	DLDDLELEYD	6	25	DE	SUL2	High affinity sulfate permease; sulfate uptake is mediated by specific sulfate transporters Sul1p and Sul2p, which control the concentration of endogenous activated sulfate intermediates
YLR099W-A	EEDGYLSDED	6	23	DE	NA	Putative protein of unknown function
YLR117C	ENVDEDIEFE	6	572	DE	CLF1	Member of the NineTeen Complex (NTC) that contains Prp19p and stabilizes U6 snRNA in catalytic forms of the spliceosome containing U2, U5, and U6 snRNAs; homolog of Drosophila crooked neck protein; interacts with U1 snRNP proteins
YLR141W	EGESEAERDE	6	331	DE	RRN5	Protein involved in transcription of rDNA by RNA polymerase I; transcription factor, member of UAF (upstream activation factor) family along with Rrn9p and Rrn10p
YLR143W	QDDEIEELFE	6	87	DE	NA	Putative protein of unknown function; green fluorescent protein (GFP)-tagged protein localizes to the cytoplasm; YLR143W is not an essential gene
YLR145W	EELGEIIDED	6	149	DE	RMP1	Subunit of RNase MRP, which processes pre-rRNA and has a role in cell cycle-regulated degradation of daughter cell-specific mRNAs; unlike most subunits, not shared between RNase MRP and nuclear RNase P
YLR149C	DVFEDDEYYE	6	604	DE	NA	Putative protein of unknown function; overexpression causes a cell cycle delay or arrest; null mutation results in a decrease in plasma membrane electron transport; YLR149C is not an essential gene
YLR175W	ETEKEEVKED	6	421	DE	CBF5	Pseudouridine synthase catalytic subunit of box H/ACA small nucleolar ribonucleoprotein particles (snoRNPs), acts on both large and small rRNAs and on snRNA U2; mutations in human ortholog dyskerin cause the disorder dyskeratosis congenita
YLR183C	YDLENDDDYE	6	447	DE	TOS4	Forkhead Associated domain containing protein and putative transcription factor found associated with chromatin; target of SBF transcription factor; expression is periodic and peaks in G1; similar to PLM2
YLR186W	DYIEKLDDDE	6	190	DE	EMG1	Member of the alpha/beta knot fold methyltransferase superfamily; required for maturation of 18S rRNA and for 40S ribosome production; interacts with RNA and with S-adenosylmethionine; associates with spindle/microtubules; forms homodimers
YLR188W	ASESDGEDEE	6	130	DE	MDL1	Mitochondrial inner membrane half-type ATP-binding cassette (ABC) transporter, mediates export of peptides generated upon proteolysis of mitochondrial proteins, plays a role in the regulation of cellular resistance to oxidative stress
YLR189C	EDSQVEDVEE	6	484	DE	ATG26	UDP-glucose:sterol glucosyltransferase, conserved enzyme involved in synthesis of sterol glucoside membrane lipids; in contrast to ATG26 from P. pastoris, S. cerevisiae ATG26 is not involved in autophagy
YLR192C	PDDFEFGDDD	6	253	DE	HCR1	Dual function protein involved in translation initiation as a substoichiometric component (eIF3j) of translation initiation factor 3 (eIF3) and required for processing of 20S pre-rRNA; binds to eIF3 subunits Rpg1p and Prt1p and 18S rRNA
YLR200W	NEEFDQLEED	6	35	DE	YKE2	Subunit of the heterohexameric Gim/prefoldin protein complex involved in the folding of alpha-tubulin, beta-tubulin, and actin
YLR210W	DEVYEDFDGE	6	141	DE	CLB4	B-type cyclin involved in cell cycle progression; activates Cdc28p to promote the G2/M transition; may be involved in DNA replication and spindle assembly; accumulates during S phase and G2, then targeted for ubiquitin-mediated degradation
YLR212C	GELEEDLDAD	6	457	DE	TUB4	Gamma-tubulin, involved in nucleating microtubules from both the cytoplasmic and nuclear faces of the spindle pole body
YLR218C	EEYKEVQEDE	6	69	DE	COA4	Twin Cx(9)C protein involved in cytochrome c oxidase assembly or stability; localizes to the mitochondrial intermembrane space via the Mia40p-Erv1p system; interacts genetically with CYC1 and with cytochrome c oxidase assembly factors
YLR222C	VEEDLKNDED	6	315	DE	UTP13	Nucleolar protein, component of the small subunit (SSU) processome containing the U3 snoRNA that is involved in processing of pre-18S rRNA
YLR225C	SEENSEEDID	6	108	DE	NA	Putative protein of unknown function; green fluorescent protein (GFP)-fusion protein localizes to the cytoplasm; YLR225C is not an essential gene
YLR233C	PDEAIDADED	6	679	DE	EST1	TLC1 RNA-associated factor involved in telomere length regulation as recruitment subunit of telomerase; has G-quadruplex promoting activity that is required for telomere elongation; possible role in activating telomere-bound Est2p-TLC1-RNA
YLR243W	DEEIGDFNDE	6	89	DE	NA	Putative protein of unknown function; YLR243W is an essential gene
YLR248W	DIQDDSTDDD	6	133	DE	RCK2	Protein kinase involved in the response to oxidative and osmotic stress; identified as suppressor of S. pombe cell cycle checkpoint mutations; similar to CaM (calmodulin) kinases
YLR250W	HEHEIEHEEE	6	190	DE	SSP120	Protein of unknown function; green fluorescent protein (GFP)-fusion protein localizes to the cytoplasm in a punctate pattern
YLR253W	EEIDELFKED	6	157	DE	NA	Putative protein of unknown function; the authentic, non-tagged protein is detected in highly purified mitochondria in high-throughput studies; transcription is periodic during the metabolic cycle; YLR253W is not an essential gene
YLR258W	DDDDDGPYAD	6	693	DE	GSY2	Glycogen synthase, similar to Gsy1p; expression induced by glucose limitation, nitrogen starvation, heat shock, and stationary phase; activity regulated by cAMP-dependent, Snf1p and Pho85p kinases as well as by the Gac1p-Glc7p phosphatase
YLR272C	LIEEEVEQDE	6	475	DE	YCS4	Subunit of the condensin complex; required for establishment and maintenance of chromosome condensation, chromosome segregation, chromatin binding of condensin, tRNA gene clustering at the nucleolus, and silencing at the mating type locus
YLR273C	EYDNESDVED	6	124	DE	PIG1	Putative targeting subunit for the type-1 protein phosphatase Glc7p that tethers it to the Gsy2p glycogen synthase
YLR274W	TMFTEEEEEE	6	346	DE	MCM5	Component of the hexameric MCM complex, which is important for priming origins of DNA replication in G1 and becomes an active ATP-dependent helicase that promotes DNA melting and elongation when activated by Cdc7p-Dbf4p in S-phase
YLR275W	AELEELEEFE	6	15	DE	SMD2	Core Sm protein Sm D2; part of heteroheptameric complex (with Smb1p, Smd1p, Smd3p, Sme1p, Smx3p, and Smx2p) that is part of the spliceosomal U1, U2, U4, and U5 snRNPs; homolog of human Sm D2
YLR285W	MFDEDEETIE	6	237	DE	NNT1	Putative nicotinamide N-methyltransferase, has a role in rDNA silencing and in lifespan determination
YLR287C	DFEDSESESD	6	214	DE	NA	Putative protein of unknown function; green fluorescent protein (GFP)-fusion protein localizes to the cytoplasm; YLR287C is not an essential gene
YLR295C	EEGESEPIEE	6	99	DE	ATP14	Subunit h of the F0 sector of mitochondrial F1F0 ATP synthase, which is a large, evolutionarily conserved enzyme complex required for ATP synthesis
YLR305C	DQEVADENDD	6	277	DE	STT4	Phosphatidylinositol-4-kinase that functions in the Pkc1p protein kinase pathway; required for normal vacuole morphology, cell wall integrity, and actin cytoskeleton organization
YLR310C	SEDYSDDDSE	6	1064	DE	CDC25	Membrane bound guanine nucleotide exchange factor (GEF or GDP-release factor); indirectly regulates adenylate cyclase through activation of Ras1p and Ras2p by stimulating the exchange of GDP for GTP; required for progression through G1
YLR314C	EEELANDQEE	6	153	DE	CDC3	Component of the septin ring of the mother-bud neck that is required for cytokinesis; septins recruit proteins to the neck and can act as a barrier to diffusion at the membrane, and they comprise the 10nm filaments seen with EM
YLR320W	APDDELDIEE	6	285	DE	MMS22	Protein that acts with Mms1p in a repair pathway that may be involved in resolving replication intermediates or preventing the damage caused by blocked replication forks; required for accurate meiotic chromosome segregation
YLR328W	EVSSEDDDAD	6	92	DE	NMA1	Nicotinic acid mononucleotide adenylyltransferase, involved in pathways of NAD biosynthesis, including the de novo, NAD(+) salvage, and nicotinamide riboside salvage pathways
YLR330W	DLDNEESNEE	6	218	DE	CHS5	Component of the exomer complex, which also contains Csh6p, Bch1p, Bch2p, and Bud7p and is involved in export of selected proteins, such as chitin synthase Chs3p, from the Golgi to the plasma membrane
YLR332W	DLDEADDVME	6	305	DE	MID2	O-glycosylated plasma membrane protein that acts as a sensor for cell wall integrity signaling and activates the pathway; interacts with Rom2p, a guanine nucleotide exchange factor for Rho1p, and with cell integrity pathway protein Zeo1p
YLR335W	DESDSENDIE	6	200	DE	NUP2	Nucleoporin involved in nucleocytoplasmic transport, binds to either the nucleoplasmic or cytoplasmic faces of the nuclear pore complex depending on Ran-GTP levels; also has a role in chromatin organization
YLR342W	EEANPEDTEE	6	261	DE	FKS1	Catalytic subunit of 1,3-beta-D-glucan synthase, functionally redundant with alternate catalytic subunit Gsc2p; binds to regulatory subunit Rho1p; involved in cell wall synthesis and maintenance; localizes to sites of cell wall remodeling
YLR347C	RQNEDPEDDD	6	334	DE	KAP95	Karyopherin beta, forms a complex with Srp1p/Kap60p; interacts with nucleoporins to mediate nuclear import of NLS-containing cargo proteins via the nuclear pore complex; regulates PC biosynthesis; GDP-to-GTP exchange factor for Gsp1p
YLR350W	EQETFEDEND	6	53	DE	ORM2	Evolutionarily conserved protein, similar to Orm1p, required for resistance to agents that induce unfolded protein response; Orm1p and Orm2p together control membrane biogenesis by coordinating lipid homeostasis with protein quality control
YLR352W	EETDDEYLHD	6	695	DE	NA	Putative protein of unknown function with similarity to F-box proteins; interacts with Skp1p and Cdc53p; YLR352W is not an essential gene
YLR353W	DDTLEPDVEE	6	223	DE	BUD8	Protein involved in bud-site selection; diploid mutants display a unipolar budding pattern instead of the wild-type bipolar pattern, and bud at the proximal pole
